quote,quote_url,author,author_url
Change will not come if we wait for some other person or some other time. We are the ones we've been waiting for. We are the change that we seek.,https://www.brainyquote.com/quotes/barack_obama_409128?src=t_change,Barack Obama,https://www.brainyquote.com/authors/barack-obama-quotes
"If you change the way you look at things, the things you look at change.",https://www.brainyquote.com/quotes/wayne_dyer_384143?src=t_change,Wayne Dyer,https://www.brainyquote.com/authors/wayne-dyer-quotes
To improve is to change; to be perfect is to change often.,https://www.brainyquote.com/quotes/winston_churchill_138235?src=t_change,Winston Churchill,https://www.brainyquote.com/authors/winston-churchill-quotes
"If you don't like something, change it. If you can't change it, change your attitude.",https://www.brainyquote.com/quotes/maya_angelou_101310?src=t_change,Maya Angelou,https://www.brainyquote.com/authors/maya-angelou-quotes
You must be the change you wish to see in the world.,https://www.brainyquote.com/quotes/mahatma_gandhi_109075?src=t_change,Mahatma Gandhi,https://www.brainyquote.com/authors/mahatma-gandhi-quotes
"God grant me the serenity to accept the things I cannot change, the courage to change the things I can, and the wisdom to know the difference.",https://www.brainyquote.com/quotes/reinhold_niebuhr_100884?src=t_change,Reinhold Niebuhr,https://www.brainyquote.com/authors/reinhold-niebuhr-quotes
"Progress is impossible without change, and those who cannot change their minds cannot change anything.",https://www.brainyquote.com/quotes/george_bernard_shaw_386923?src=t_change,George Bernard Shaw,https://www.brainyquote.com/authors/george-bernard-shaw-quotes
"Some people don't like change, but you need to embrace change if the alternative is disaster.",https://www.brainyquote.com/quotes/elon_musk_567256?src=t_change,Elon Musk,https://www.brainyquote.com/authors/elon-musk-quotes
"We cannot change anything until we accept it. Condemnation does not liberate, it oppresses.",https://www.brainyquote.com/quotes/carl_jung_101266?src=t_change,Carl Jung,https://www.brainyquote.com/authors/carl-jung-quotes
When we are no longer able to change a situation - we are challenged to change ourselves.,https://www.brainyquote.com/quotes/viktor_e_frankl_121087?src=t_change,Viktor E. Frankl,https://www.brainyquote.com/authors/viktor-e-frankl-quotes
There is nothing permanent except change.,https://www.brainyquote.com/quotes/heraclitus_165537?src=t_change,Heraclitus,https://www.brainyquote.com/authors/heraclitus-quotes
Change is the law of life. And those who look only to the past or present are certain to miss the future.,https://www.brainyquote.com/quotes/john_f_kennedy_121068?src=t_change,John F. Kennedy,https://www.brainyquote.com/authors/john-f-kennedy-quotes
"If you do not change direction, you may end up where you are heading.",https://www.brainyquote.com/quotes/lao_tzu_121075?src=t_change,Lao Tzu,https://www.brainyquote.com/authors/lao-tzu-quotes
"They always say time changes things, but you actually have to change them yourself.",https://www.brainyquote.com/quotes/andy_warhol_109768?src=t_change,Andy Warhol,https://www.brainyquote.com/authors/andy-warhol-quotes
"The only way to make sense out of change is to plunge into it, move with it, and join the dance.",https://www.brainyquote.com/quotes/alan_watts_386511?src=t_change,Alan Watts,https://www.brainyquote.com/authors/alan-watts-quotes
The first step toward change is awareness. The second step is acceptance.,https://www.brainyquote.com/quotes/nathaniel_branden_163773?src=t_change,Nathaniel Branden,https://www.brainyquote.com/authors/nathaniel-branden-quotes
"If there is no struggle, there is no progress.",https://www.brainyquote.com/quotes/frederick_douglass_377775?src=t_change,Frederick Douglass,https://www.brainyquote.com/authors/frederick-douglass-quotes
"Change does not roll in on the wheels of inevitability, but comes through continuous struggle. And so we must straighten our backs and work for our freedom. A man can't ride you unless your back is bent.",https://www.brainyquote.com/quotes/martin_luther_king_jr_121065?src=t_change,"Martin Luther King, Jr.",https://www.brainyquote.com/authors/martin-luther-king-jr-quotes
"If we don't change, we don't grow. If we don't grow, we aren't really living.",https://www.brainyquote.com/quotes/gail_sheehy_161346?src=t_change,Gail Sheehy,https://www.brainyquote.com/authors/gail-sheehy-quotes
"Everyone thinks of changing the world, but no one thinks of changing himself.",https://www.brainyquote.com/quotes/leo_tolstoy_105644?src=t_change,Leo Tolstoy,https://www.brainyquote.com/authors/leo-tolstoy-quotes
Things do not change; we change.,https://www.brainyquote.com/quotes/henry_david_thoreau_104516?src=t_change,Henry David Thoreau,https://www.brainyquote.com/authors/henry-david-thoreau-quotes
"Life is about not knowing, having to change, taking the moment and making the best of it, without knowing what's going to happen next.",https://www.brainyquote.com/quotes/gilda_radner_135101?src=t_change,Gilda Radner,https://www.brainyquote.com/authors/gilda-radner-quotes
Change is inevitable. Change is constant.,https://www.brainyquote.com/quotes/benjamin_disraeli_154148?src=t_change,Benjamin Disraeli,https://www.brainyquote.com/authors/benjamin-disraeli-quotes
Change before you have to.,https://www.brainyquote.com/quotes/jack_welch_110363?src=t_change,Jack Welch,https://www.brainyquote.com/authors/jack-welch-quotes
Only the wisest and stupidest of men never change.,https://www.brainyquote.com/quotes/confucius_101312?src=t_change,Confucius,https://www.brainyquote.com/authors/confucius-quotes
"The curious paradox is that when I accept myself just as I am, then I can change.",https://www.brainyquote.com/quotes/carl_rogers_385131?src=t_change,Carl Rogers,https://www.brainyquote.com/authors/carl-rogers-quotes
"Miracles happen everyday, change your perception of what a miracle is and you'll see them all around you.",https://www.brainyquote.com/quotes/jon_bon_jovi_381530?src=t_change,Jon Bon Jovi,https://www.brainyquote.com/authors/jon-bon-jovi-quotes
He who rejects change is the architect of decay. The only human institution which rejects progress is the cemetery.,https://www.brainyquote.com/quotes/harold_wilson_104500?src=t_change,Harold Wilson,https://www.brainyquote.com/authors/harold-wilson-quotes
Money and success don't change people; they merely amplify what is already there.,https://www.brainyquote.com/quotes/will_smith_167216?src=t_change,Will Smith,https://www.brainyquote.com/authors/will-smith-quotes
"Without change, something sleeps inside us, and seldom awakens. The sleeper must awaken.",https://www.brainyquote.com/quotes/frank_herbert_101313?src=t_change,Frank Herbert,https://www.brainyquote.com/authors/frank-herbert-quotes
There is nothing so stable as change.,https://www.brainyquote.com/quotes/bob_dylan_164596?src=t_change,Bob Dylan,https://www.brainyquote.com/authors/bob-dylan-quotes
"For the past 33 years, I have looked in the mirror every morning and asked myself: 'If today were the last day of my life, would I want to do what I am about to do today?' And whenever the answer has been 'No' for too many days in a row, I know I need to change something.",https://www.brainyquote.com/quotes/steve_jobs_416877?src=t_change,Steve Jobs,https://www.brainyquote.com/authors/steve-jobs-quotes
Slowness to change usually means fear of the new.,https://www.brainyquote.com/quotes/phil_crosby_178058?src=t_change,Phil Crosby,https://www.brainyquote.com/authors/phil-crosby-quotes
"My friends, love is better than anger. Hope is better than fear. Optimism is better than despair. So let us be loving, hopeful and optimistic. And we'll change the world.",https://www.brainyquote.com/quotes/jack_layton_417374?src=t_change,Jack Layton,https://www.brainyquote.com/authors/jack-layton-quotes
"All change is not growth, as all movement is not forward.",https://www.brainyquote.com/quotes/ellen_glasgow_104512?src=t_change,Ellen Glasgow,https://www.brainyquote.com/authors/ellen-glasgow-quotes
Progress is a nice word. But change is its motivator. And change has its enemies.,https://www.brainyquote.com/quotes/robert_kennedy_138515?src=t_change,Robert Kennedy,https://www.brainyquote.com/authors/robert-kennedy-quotes
"It may be hard for an egg to turn into a bird: it would be a jolly sight harder for it to learn to fly while remaining an egg. We are like eggs at present. And you cannot go on indefinitely being just an ordinary, decent egg. We must be hatched or go bad.",https://www.brainyquote.com/quotes/c_s_lewis_131286?src=t_change,C. S. Lewis,https://www.brainyquote.com/authors/c-s-lewis-quotes
"Loss is nothing else but change, and change is Nature's delight.",https://www.brainyquote.com/quotes/marcus_aurelius_148748?src=t_change,Marcus Aurelius,https://www.brainyquote.com/authors/marcus-aurelius-quotes
"Any change, even a change for the better, is always accompanied by drawbacks and discomforts.",https://www.brainyquote.com/quotes/arnold_bennett_101311?src=t_change,Arnold Bennett,https://www.brainyquote.com/authors/arnold-bennett-quotes
"Since we cannot change reality, let us change the eyes which see reality.",https://www.brainyquote.com/quotes/nikos_kazantzakis_176142?src=t_change,Nikos Kazantzakis,https://www.brainyquote.com/authors/nikos-kazantzakis-quotes
"I hope everyone that is reading this is having a really good day. And if you are not, just know that in every new minute that passes you have an opportunity to change that.",https://www.brainyquote.com/quotes/gillian_anderson_401718?src=t_change,Gillian Anderson,https://www.brainyquote.com/authors/gillian-anderson-quotes
The world is changing very fast. Big will not beat small anymore. It will be the fast beating the slow.,https://www.brainyquote.com/quotes/rupert_murdoch_173446?src=t_change,Rupert Murdoch,https://www.brainyquote.com/authors/rupert-murdoch-quotes
Sometimes it's the smallest decisions that can change your life forever.,https://www.brainyquote.com/quotes/keri_russell_183404?src=t_change,Keri Russell,https://www.brainyquote.com/authors/keri-russell-quotes
"All changes, even the most longed for, have their melancholy; for what we leave behind us is a part of ourselves; we must die to one life before we can enter another.",https://www.brainyquote.com/quotes/anatole_france_104501?src=t_change,Anatole France,https://www.brainyquote.com/authors/anatole-france-quotes
"Change the changeable, accept the unchangeable, and remove yourself from the unacceptable.",https://www.brainyquote.com/quotes/denis_waitley_146906?src=t_change,Denis Waitley,https://www.brainyquote.com/authors/denis-waitley-quotes
One change always leaves the way open for the establishment of others.,https://www.brainyquote.com/quotes/niccolo_machiavelli_157835?src=t_change,Niccolo Machiavelli,https://www.brainyquote.com/authors/niccolo-machiavelli-quotes
"Because things are the way they are, things will not stay the way they are.",https://www.brainyquote.com/quotes/bertolt_brecht_131165?src=t_change,Bertolt Brecht,https://www.brainyquote.com/authors/bertolt-brecht-quotes
All great change in America begins at the dinner table.,https://www.brainyquote.com/quotes/ronald_reagan_183750?src=t_change,Ronald Reagan,https://www.brainyquote.com/authors/ronald-reagan-quotes
I cannot say whether things will get better if we change; what I can say is they must change if they are to get better.,https://www.brainyquote.com/quotes/georg_c_lichtenberg_100843?src=t_change,Georg C. Lichtenberg,https://www.brainyquote.com/authors/georg-c-lichtenberg-quotes
"Change alone is eternal, perpetual, immortal.",https://www.brainyquote.com/quotes/arthur_schopenhauer_163700?src=t_change,Arthur Schopenhauer,https://www.brainyquote.com/authors/arthur-schopenhauer-quotes
Our dilemma is that we hate change and love it at the same time; what we really want is for things to remain the same but get better.,https://www.brainyquote.com/quotes/sydney_j_harris_152638?src=t_change,Sydney J. Harris,https://www.brainyquote.com/authors/sydney-j-harris-quotes
"Just when I think I have learned the way to live, life changes.",https://www.brainyquote.com/quotes/hugh_prather_107702?src=t_change,Hugh Prather,https://www.brainyquote.com/authors/hugh-prather-quotes
You're only as young as the last time you changed your mind.,https://www.brainyquote.com/quotes/timothy_leary_103937?src=t_change,Timothy Leary,https://www.brainyquote.com/authors/timothy-leary-quotes
"Sometimes if you want to see a change for the better, you have to take things into your own hands.",https://www.brainyquote.com/quotes/clint_eastwood_120948?src=t_change,Clint Eastwood,https://www.brainyquote.com/authors/clint-eastwood-quotes
Just because everything is different doesn't mean anything has changed.,https://www.brainyquote.com/quotes/irene_peter_161612?src=t_change,Irene Peter,https://www.brainyquote.com/authors/irene-peter-quotes
"The world hates change, yet it is the only thing that has brought progress.",https://www.brainyquote.com/quotes/charles_kettering_122377?src=t_change,Charles Kettering,https://www.brainyquote.com/authors/charles-kettering-quotes
Change in all things is sweet.,https://www.brainyquote.com/quotes/aristotle_121066?src=t_change,Aristotle,https://www.brainyquote.com/authors/aristotle-quotes
"Life belongs to the living, and he who lives must be prepared for changes.",https://www.brainyquote.com/quotes/johann_wolfgang_von_goeth_131279?src=t_change,Johann Wolfgang von Goethe,https://www.brainyquote.com/authors/johann-wolfgang-von-goeth-quotes
"In order to change the world, you have to get your head together first.",https://www.brainyquote.com/quotes/jimi_hendrix_195410?src=t_change,Jimi Hendrix,https://www.brainyquote.com/authors/jimi-hendrix-quotes
"If you want to change attitudes, start with a change in behavior.",https://www.brainyquote.com/quotes/william_glasser_345823?src=t_change,William Glasser,https://www.brainyquote.com/authors/william-glasser-quotes
