quote,quote_url,author,author_url
"I have a dream that my four little children will one day live in a nation where they will not be judged by the color of their skin, but by the content of their character.",https://www.brainyquote.com/quotes/martin_luther_king_jr_115056?src=t_equality,"Martin Luther King, Jr.",https://www.brainyquote.com/authors/martin-luther-king-jr-quotes
The worst form of inequality is to try to make unequal things equal.,https://www.brainyquote.com/quotes/aristotle_140848?src=t_equality,Aristotle,https://www.brainyquote.com/authors/aristotle-quotes
"If you want to see the true measure of a man, watch how he treats his inferiors, not his equals.",https://www.brainyquote.com/quotes/j_k_rowling_178389?src=t_equality,J. K. Rowling,https://www.brainyquote.com/authors/j-k-rowling-quotes
"Until we get equality in education, we won't have an equal society.",https://www.brainyquote.com/quotes/sonia_sotomayor_454926?src=t_equality,Sonia Sotomayor,https://www.brainyquote.com/authors/sonia-sotomayor-quotes
"There should be no discrimination against languages people speak, skin color, or religion.",https://www.brainyquote.com/quotes/malala_yousafzai_662527?src=t_equality,Malala Yousafzai,https://www.brainyquote.com/authors/malala-yousafzai-quotes
"Rightful liberty is unobstructed action according to our will within limits drawn around us by the equal rights of others. I do not add 'within the limits of the law' because law is often but the tyrant's will, and always so when it violates the rights of the individual.",https://www.brainyquote.com/quotes/thomas_jefferson_136362?src=t_equality,Thomas Jefferson,https://www.brainyquote.com/authors/thomas-jefferson-quotes
"The earth is the mother of all people, and all people should have equal rights upon it.",https://www.brainyquote.com/quotes/chief_joseph_280225?src=t_equality,Chief Joseph,https://www.brainyquote.com/authors/chief-joseph-quotes
"Gender equality is more than a goal in itself. It is a precondition for meeting the challenge of reducing poverty, promoting sustainable development and building good governance.",https://www.brainyquote.com/quotes/kofi_annan_401690?src=t_equality,Kofi Annan,https://www.brainyquote.com/authors/kofi-annan-quotes
"Equality is the soul of liberty; there is, in fact, no liberty without it.",https://www.brainyquote.com/quotes/frances_wright_381289?src=t_equality,Frances Wright,https://www.brainyquote.com/authors/frances-wright-quotes
Before God we are all equally wise - and equally foolish.,https://www.brainyquote.com/quotes/albert_einstein_100645?src=t_equality,Albert Einstein,https://www.brainyquote.com/authors/albert-einstein-quotes
"Here are the values that I stand for: honesty, equality, kindness, compassion, treating people the way you want to be treated and helping those in need. To me, those are traditional values.",https://www.brainyquote.com/quotes/ellen_degeneres_451768?src=t_equality,Ellen DeGeneres,https://www.brainyquote.com/authors/ellen-degeneres-quotes
The sole equality on earth is death.,https://www.brainyquote.com/quotes/philip_james_bailey_380516?src=t_equality,Philip James Bailey,https://www.brainyquote.com/authors/philip-james-bailey-quotes
We will never have true civilization until we have learned to recognize the rights of others.,https://www.brainyquote.com/quotes/will_rogers_386200?src=t_equality,Will Rogers,https://www.brainyquote.com/authors/will-rogers-quotes
"Democracy and socialism have nothing in common but one word, equality. But notice the difference: while democracy seeks equality in liberty, socialism seeks equality in restraint and servitude.",https://www.brainyquote.com/quotes/alexis_de_tocqueville_135752?src=t_equality,Alexis de Tocqueville,https://www.brainyquote.com/authors/alexis-de-tocqueville-quotes
I am free of all prejudices. I hate everyone equally.,https://www.brainyquote.com/quotes/w_c_fields_100020?src=t_equality,W. C. Fields,https://www.brainyquote.com/authors/w-c-fields-quotes
No struggle can ever succeed without women participating side by side with men.,https://www.brainyquote.com/quotes/muhammad_ali_jinnah_372003?src=t_equality,Muhammad Ali Jinnah,https://www.brainyquote.com/authors/muhammad-ali-jinnah-quotes
Democracy does not guarantee equality of conditions - it only guarantees equality of opportunity.,https://www.brainyquote.com/quotes/irving_kristol_103745?src=t_equality,Irving Kristol,https://www.brainyquote.com/authors/irving-kristol-quotes
"Democracy... is a charming form of government, full of variety and disorder; and dispensing a sort of equality to equals and unequals alike.",https://www.brainyquote.com/quotes/plato_135639?src=t_equality,Plato,https://www.brainyquote.com/authors/plato-quotes
Women will only have true equality when men share with them the responsibility of bringing up the next generation.,https://www.brainyquote.com/quotes/ruth_bader_ginsburg_218235?src=t_equality,Ruth Bader Ginsburg,https://www.brainyquote.com/authors/ruth-bader-ginsburg-quotes
The history of the past is but one long struggle upward to equality.,https://www.brainyquote.com/quotes/elizabeth_cady_stanton_400013?src=t_equality,Elizabeth Cady Stanton,https://www.brainyquote.com/authors/elizabeth-cady-stanton-quotes
"Martin Luther King, Jr. didn't carry just a piece of cloth to symbolize his belief in racial equality; he carried the American flag.",https://www.brainyquote.com/quotes/adrian_cronauer_401975?src=t_equality,Adrian Cronauer,https://www.brainyquote.com/authors/adrian-cronauer-quotes
"Equality, rightly understood as our founding fathers understood it, leads to liberty and to the emancipation of creative differences; wrongly understood, as it has been so tragically in our time, it leads first to conformity and then to despotism.",https://www.brainyquote.com/quotes/barry_goldwater_269741?src=t_equality,Barry Goldwater,https://www.brainyquote.com/authors/barry-goldwater-quotes
"If we cannot now end our differences, at least we can help make the world safe for diversity.",https://www.brainyquote.com/quotes/john_f_kennedy_101850?src=t_equality,John F. Kennedy,https://www.brainyquote.com/authors/john-f-kennedy-quotes
"All animals are equal, but some animals are more equal than others.",https://www.brainyquote.com/quotes/george_orwell_100005?src=t_equality,George Orwell,https://www.brainyquote.com/authors/george-orwell-quotes
"All the people like us are we, and everyone else is They.",https://www.brainyquote.com/quotes/rudyard_kipling_125488?src=t_equality,Rudyard Kipling,https://www.brainyquote.com/authors/rudyard-kipling-quotes
"Racism is still with us. But it is up to us to prepare our children for what they have to meet, and, hopefully, we shall overcome.",https://www.brainyquote.com/quotes/rosa_parks_390200?src=t_equality,Rosa Parks,https://www.brainyquote.com/authors/rosa-parks-quotes
"Equality may perhaps be a right, but no power on earth can ever turn it into a fact.",https://www.brainyquote.com/quotes/honore_de_balzac_149911?src=t_equality,Honore de Balzac,https://www.brainyquote.com/authors/honore-de-balzac-quotes
A claim for equality of material position can be met only by a government with totalitarian powers.,https://www.brainyquote.com/quotes/friedrich_august_von_haye_201842?src=t_equality,Friedrich August von Hayek,https://www.brainyquote.com/authors/friedrich-august-von-haye-quotes
"Equality is not in regarding different things similarly, equality is in regarding different things differently.",https://www.brainyquote.com/quotes/tom_robbins_387517?src=t_equality,Tom Robbins,https://www.brainyquote.com/authors/tom-robbins-quotes
"The emotional, sexual, and psychological stereotyping of females begins when the doctor says: It's a girl.",https://www.brainyquote.com/quotes/shirley_chisholm_101403?src=t_equality,Shirley Chisholm,https://www.brainyquote.com/authors/shirley-chisholm-quotes
Virtue can only flourish among equals.,https://www.brainyquote.com/quotes/mary_wollstonecraft_204498?src=t_equality,Mary Wollstonecraft,https://www.brainyquote.com/authors/mary-wollstonecraft-quotes
All this talk about equality. The only thing people really have in common is that they are all going to die.,https://www.brainyquote.com/quotes/bob_dylan_154483?src=t_equality,Bob Dylan,https://www.brainyquote.com/authors/bob-dylan-quotes
"You learn about equality in history and civics, but you find out life is not really like that.",https://www.brainyquote.com/quotes/arthur_ashe_386266?src=t_equality,Arthur Ashe,https://www.brainyquote.com/authors/arthur-ashe-quotes
Women are the only exploited group in history to have been idealized into powerlessness.,https://www.brainyquote.com/quotes/erica_jong_161668?src=t_equality,Erica Jong,https://www.brainyquote.com/authors/erica-jong-quotes
"Four score and seven years ago our fathers brought forth on this continent, a new nation, conceived in Liberty, and dedicated to the proposition that all men are created equal.",https://www.brainyquote.com/quotes/abraham_lincoln_101407?src=t_equality,Abraham Lincoln,https://www.brainyquote.com/authors/abraham-lincoln-quotes
The extension of women's rights is the basic principle of all social progress.,https://www.brainyquote.com/quotes/charles_fourier_312075?src=t_equality,Charles Fourier,https://www.brainyquote.com/authors/charles-fourier-quotes
I am an aristocrat. I love liberty; I hate equality.,https://www.brainyquote.com/quotes/john_randolph_164208?src=t_equality,John Randolph,https://www.brainyquote.com/authors/john-randolph-quotes
Suffrage is the pivotal right.,https://www.brainyquote.com/quotes/susan_b_anthony_164365?src=t_equality,Susan B. Anthony,https://www.brainyquote.com/authors/susan-b-anthony-quotes
"In order to get beyond racism, we must first take account of race. There is no other way. And in order to treat some persons equally, we must treat them differently.",https://www.brainyquote.com/quotes/harry_a_blackmun_134225?src=t_equality,Harry A. Blackmun,https://www.brainyquote.com/authors/harry-a-blackmun-quotes
The battle for women's rights has been largely won.,https://www.brainyquote.com/quotes/margaret_thatcher_153836?src=t_equality,Margaret Thatcher,https://www.brainyquote.com/authors/margaret-thatcher-quotes
"Coming generations will learn equality from poverty, and love from woes.",https://www.brainyquote.com/quotes/khalil_gibran_101593?src=t_equality,Khalil Gibran,https://www.brainyquote.com/authors/khalil-gibran-quotes
"In America everybody is of the opinion that he has no social superiors, since all men are equal, but he does not admit that he has no social inferiors, for, from the time of Jefferson onward, the doctrine that all men are equal applies only upwards, not downwards.",https://www.brainyquote.com/quotes/bertrand_russell_105013?src=t_equality,Bertrand Russell,https://www.brainyquote.com/authors/bertrand-russell-quotes
People are pretty much alike. It's only that our differences are more susceptible to definition than our similarities.,https://www.brainyquote.com/quotes/linda_ellerbee_105014?src=t_equality,Linda Ellerbee,https://www.brainyquote.com/authors/linda-ellerbee-quotes
"Women's rights is not only an abstraction, a cause; it is also a personal affair. It is not only about us; it is also about me and you. Just the two of us.",https://www.brainyquote.com/quotes/toni_morrison_399324?src=t_equality,Toni Morrison,https://www.brainyquote.com/authors/toni-morrison-quotes
"I believe in equality for everyone, except reporters and photographers.",https://www.brainyquote.com/quotes/mahatma_gandhi_105881?src=t_equality,Mahatma Gandhi,https://www.brainyquote.com/authors/mahatma-gandhi-quotes
Private religious speech can't be discriminated against. It has to be treated equally with secular speech.,https://www.brainyquote.com/quotes/samuel_alito_405607?src=t_equality,Samuel Alito,https://www.brainyquote.com/authors/samuel-alito-quotes
Socialism values equality more than liberty.,https://www.brainyquote.com/quotes/dennis_prager_201155?src=t_equality,Dennis Prager,https://www.brainyquote.com/authors/dennis-prager-quotes
"We came equals into this world, and equals shall we go out of it.",https://www.brainyquote.com/quotes/george_mason_253935?src=t_equality,George Mason,https://www.brainyquote.com/authors/george-mason-quotes
"I want for myself what I want for other women, absolute equality.",https://www.brainyquote.com/quotes/agnes_macphail_399609?src=t_equality,Agnes Macphail,https://www.brainyquote.com/authors/agnes-macphail-quotes
From the equality of rights springs identity of our highest interests; you cannot subvert your neighbor's rights without striking a dangerous blow at your own.,https://www.brainyquote.com/quotes/carl_schurz_133659?src=t_equality,Carl Schurz,https://www.brainyquote.com/authors/carl-schurz-quotes
Do not call for black power or green power. Call for brain power.,https://www.brainyquote.com/quotes/barbara_jordan_131862?src=t_equality,Barbara Jordan,https://www.brainyquote.com/authors/barbara-jordan-quotes
"I believe in the equality of man; and I believe that religious duties consist in doing justice, loving mercy, and endeavoring to make our fellow-creatures happy.",https://www.brainyquote.com/quotes/thomas_paine_159459?src=t_equality,Thomas Paine,https://www.brainyquote.com/authors/thomas-paine-quotes
Nature has made men free and equal. The distinctions necessary for social order are only founded on general utility.,https://www.brainyquote.com/quotes/marquis_de_lafayette_740870?src=t_equality,Marquis de Lafayette,https://www.brainyquote.com/authors/marquis-de-lafayette-quotes
The cry of equality pulls everyone down.,https://www.brainyquote.com/quotes/iris_murdoch_137273?src=t_equality,Iris Murdoch,https://www.brainyquote.com/authors/iris-murdoch-quotes
"The year was 2081, and everyone was finally equal.",https://www.brainyquote.com/quotes/kurt_vonnegut_145571?src=t_equality,Kurt Vonnegut,https://www.brainyquote.com/authors/kurt-vonnegut-quotes
"To be successful, a woman has to be much better at her job than a man.",https://www.brainyquote.com/quotes/golda_meir_101408?src=t_equality,Golda Meir,https://www.brainyquote.com/authors/golda-meir-quotes
"There can be no equality or opportunity if men and women and children be not shielded in their lives from the consequences of great industrial and social processes which they cannot alter, control, or singly cope with.",https://www.brainyquote.com/quotes/woodrow_wilson_130496?src=t_equality,Woodrow Wilson,https://www.brainyquote.com/authors/woodrow-wilson-quotes
Equality and self-determination should never be divided in the name of religious or ideological fervor.,https://www.brainyquote.com/quotes/rita_dove_589164?src=t_equality,Rita Dove,https://www.brainyquote.com/authors/rita-dove-quotes
"All men are created equal, it is only men themselves who place themselves above equality.",https://www.brainyquote.com/quotes/david_allan_coe_204301?src=t_equality,David Allan Coe,https://www.brainyquote.com/authors/david-allan-coe-quotes
"It is better that some should be unhappy rather than that none should be happy, which would be the case in a general state of equality.",https://www.brainyquote.com/quotes/samuel_johnson_135382?src=t_equality,Samuel Johnson,https://www.brainyquote.com/authors/samuel-johnson-quotes
