quote,quote_url,author,author_url
"I have not failed. I've just found 10,000 ways that won't work.",https://www.brainyquote.com/quotes/thomas_a_edison_132683?src=t_failure,Thomas A. Edison,https://www.brainyquote.com/authors/thomas-a-edison-quotes
Nothing in this world can take the place of persistence. Talent will not: nothing is more common than unsuccessful men with talent. Genius will not; unrewarded genius is almost a proverb. Education will not: the world is full of educated derelicts. Persistence and determination alone are omnipotent.,https://www.brainyquote.com/quotes/calvin_coolidge_414555?src=t_failure,Calvin Coolidge,https://www.brainyquote.com/authors/calvin-coolidge-quotes
"Far better is it to dare mighty things, to win glorious triumphs, even though checkered by failure... than to rank with those poor spirits who neither enjoy nor suffer much, because they live in a gray twilight that knows not victory nor defeat.",https://www.brainyquote.com/quotes/theodore_roosevelt_103499?src=t_failure,Theodore Roosevelt,https://www.brainyquote.com/authors/theodore-roosevelt-quotes
But man is not made for defeat. A man can be destroyed but not defeated.,https://www.brainyquote.com/quotes/ernest_hemingway_152926?src=t_failure,Ernest Hemingway,https://www.brainyquote.com/authors/ernest-hemingway-quotes
"A failure is not always a mistake, it may simply be the best one can do under the circumstances. The real mistake is to stop trying.",https://www.brainyquote.com/quotes/b_f_skinner_393571?src=t_failure,B. F. Skinner,https://www.brainyquote.com/authors/b-f-skinner-quotes
"I can accept failure, everyone fails at something. But I can't accept not trying.",https://www.brainyquote.com/quotes/michael_jordan_385092?src=t_failure,Michael Jordan,https://www.brainyquote.com/authors/michael-jordan-quotes
"Every adversity, every failure, every heartache carries with it the seed of an equal or greater benefit.",https://www.brainyquote.com/quotes/napoleon_hill_121336?src=t_failure,Napoleon Hill,https://www.brainyquote.com/authors/napoleon-hill-quotes
Defeat may serve as well as victory to shake the soul and let the glory out.,https://www.brainyquote.com/quotes/edwin_markham_161556?src=t_failure,Edwin Markham,https://www.brainyquote.com/authors/edwin-markham-quotes
It's fine to celebrate success but it is more important to heed the lessons of failure.,https://www.brainyquote.com/quotes/bill_gates_385735?src=t_failure,Bill Gates,https://www.brainyquote.com/authors/bill-gates-quotes
Failure is the key to success; each mistake teaches us something.,https://www.brainyquote.com/quotes/morihei_ueshiba_183597?src=t_failure,Morihei Ueshiba,https://www.brainyquote.com/authors/morihei-ueshiba-quotes
"You are capable of more than you know. Choose a goal that seems right for you and strive to be the best, however hard the path. Aim high. Behave honorably. Prepare to be alone at times, and to endure failure. Persist! The world needs all you can give.",https://www.brainyquote.com/quotes/e_o_wilson_176376?src=t_failure,E. O. Wilson,https://www.brainyquote.com/authors/e-o-wilson-quotes
Ambition is the last refuge of the failure.,https://www.brainyquote.com/quotes/oscar_wilde_117770?src=t_failure,Oscar Wilde,https://www.brainyquote.com/authors/oscar-wilde-quotes
"Do not be embarrassed by your failures, learn from them and start again.",https://www.brainyquote.com/quotes/richard_branson_452112?src=t_failure,Richard Branson,https://www.brainyquote.com/authors/richard-branson-quotes
Success is not built on success. It's built on failure. It's built on frustration. Sometimes its built on catastrophe.,https://www.brainyquote.com/quotes/sumner_redstone_227812?src=t_failure,Sumner Redstone,https://www.brainyquote.com/authors/sumner-redstone-quotes
Failure is the condiment that gives success its flavor.,https://www.brainyquote.com/quotes/truman_capote_103858?src=t_failure,Truman Capote,https://www.brainyquote.com/authors/truman-capote-quotes
Mistakes are the portals of discovery.,https://www.brainyquote.com/quotes/james_joyce_106797?src=t_failure,James Joyce,https://www.brainyquote.com/authors/james-joyce-quotes
"It is impossible to live without failing at something, unless you live so cautiously that you might as well not have lived at all, in which case you have failed by default.",https://www.brainyquote.com/quotes/j_k_rowling_415670?src=t_failure,J. K. Rowling,https://www.brainyquote.com/authors/j-k-rowling-quotes
"Do not brood over your past mistakes and failures as this will only fill your mind with grief, regret and depression. Do not repeat them in the future.",https://www.brainyquote.com/quotes/swami_sivananda_155120?src=t_failure,Swami Sivananda,https://www.brainyquote.com/authors/swami-sivananda-quotes
"My great concern is not whether you have failed, but whether you are content with your failure.",https://www.brainyquote.com/quotes/abraham_lincoln_121354?src=t_failure,Abraham Lincoln,https://www.brainyquote.com/authors/abraham-lincoln-quotes
"A man can fail many times, but he isn't a failure until he begins to blame somebody else.",https://www.brainyquote.com/quotes/john_burroughs_121353?src=t_failure,John Burroughs,https://www.brainyquote.com/authors/john-burroughs-quotes
Success breeds complacency. Complacency breeds failure. Only the paranoid survive.,https://www.brainyquote.com/quotes/andy_grove_471638?src=t_failure,Andy Grove,https://www.brainyquote.com/authors/andy-grove-quotes
"Remember that failure is an event, not a person.",https://www.brainyquote.com/quotes/zig_ziglar_378592?src=t_failure,Zig Ziglar,https://www.brainyquote.com/authors/zig-ziglar-quotes
"The greatest glory in living lies not in never falling, but in rising every time we fall.",https://www.brainyquote.com/quotes/ralph_waldo_emerson_178794?src=t_failure,Ralph Waldo Emerson,https://www.brainyquote.com/authors/ralph-waldo-emerson-quotes
"Failure should be our teacher, not our undertaker. Failure is delay, not defeat. It is a temporary detour, not a dead end. Failure is something we can avoid only by saying nothing, doing nothing, and being nothing.",https://www.brainyquote.com/quotes/denis_waitley_125740?src=t_failure,Denis Waitley,https://www.brainyquote.com/authors/denis-waitley-quotes
There is no such thing as failure. There are only results.,https://www.brainyquote.com/quotes/tony_robbins_147788?src=t_failure,Tony Robbins,https://www.brainyquote.com/authors/tony-robbins-quotes
Every failure is a step to success.,https://www.brainyquote.com/quotes/william_whewell_126253?src=t_failure,William Whewell,https://www.brainyquote.com/authors/william-whewell-quotes
"Failures, repeated failures, are finger posts on the road to achievement. One fails forward toward success.",https://www.brainyquote.com/quotes/c_s_lewis_119178?src=t_failure,C. S. Lewis,https://www.brainyquote.com/authors/c-s-lewis-quotes
"Winning is great, sure, but if you are really going to do something in life, the secret is learning how to lose. Nobody goes undefeated all the time. If you can pick up after a crushing defeat, and go on to win again, you are going to be a champion someday.",https://www.brainyquote.com/quotes/wilma_rudolph_184352?src=t_failure,Wilma Rudolph,https://www.brainyquote.com/authors/wilma-rudolph-quotes
The season of failure is the best time for sowing the seeds of success.,https://www.brainyquote.com/quotes/paramahansa_yogananda_126260?src=t_failure,Paramahansa Yogananda,https://www.brainyquote.com/authors/paramahansa-yogananda-quotes
Failure is a word unknown to me.,https://www.brainyquote.com/quotes/muhammad_ali_jinnah_372017?src=t_failure,Muhammad Ali Jinnah,https://www.brainyquote.com/authors/muhammad-ali-jinnah-quotes
"Remembering that I'll be dead soon is the most important tool I've ever encountered to help me make the big choices in life. Because almost everything - all external expectations, all pride, all fear of embarrassment or failure - these things just fall away in the face of death, leaving only what is truly important.",https://www.brainyquote.com/quotes/steve_jobs_416852?src=t_failure,Steve Jobs,https://www.brainyquote.com/authors/steve-jobs-quotes
An essential aspect of creativity is not being afraid to fail.,https://www.brainyquote.com/quotes/edwin_land_193302?src=t_failure,Edwin Land,https://www.brainyquote.com/authors/edwin-land-quotes
Success is often achieved by those who don't know that failure is inevitable.,https://www.brainyquote.com/quotes/coco_chanel_384656?src=t_failure,Coco Chanel,https://www.brainyquote.com/authors/coco-chanel-quotes
"If you're not failing every now and again, it's a sign you're not doing anything very innovative.",https://www.brainyquote.com/quotes/woody_allen_121347?src=t_failure,Woody Allen,https://www.brainyquote.com/authors/woody-allen-quotes
Age wrinkles the body. Quitting wrinkles the soul.,https://www.brainyquote.com/quotes/douglas_macarthur_378358?src=t_failure,Douglas MacArthur,https://www.brainyquote.com/authors/douglas-macarthur-quotes
"I think and think for months and years. Ninety-nine times, the conclusion is false. The hundredth time I am right.",https://www.brainyquote.com/quotes/albert_einstein_109019?src=t_failure,Albert Einstein,https://www.brainyquote.com/authors/albert-einstein-quotes
Success comes when people act together; failure tends to happen alone.,https://www.brainyquote.com/quotes/deepak_chopra_453952?src=t_failure,Deepak Chopra,https://www.brainyquote.com/authors/deepak-chopra-quotes
You always pass failure on your way to success.,https://www.brainyquote.com/quotes/mickey_rooney_165076?src=t_failure,Mickey Rooney,https://www.brainyquote.com/authors/mickey-rooney-quotes
"We have forty million reasons for failure, but not a single excuse.",https://www.brainyquote.com/quotes/rudyard_kipling_391620?src=t_failure,Rudyard Kipling,https://www.brainyquote.com/authors/rudyard-kipling-quotes
Through perseverance many people win success out of what seemed destined to be certain failure.,https://www.brainyquote.com/quotes/benjamin_disraeli_154201?src=t_failure,Benjamin Disraeli,https://www.brainyquote.com/authors/benjamin-disraeli-quotes
Show me a good and gracious loser and I'll show you a failure.,https://www.brainyquote.com/quotes/knute_rockne_147478?src=t_failure,Knute Rockne,https://www.brainyquote.com/authors/knute-rockne-quotes
Success represents the 1% of your work which results from the 99% that is called failure.,https://www.brainyquote.com/quotes/soichiro_honda_350000?src=t_failure,Soichiro Honda,https://www.brainyquote.com/authors/soichiro-honda-quotes
Do not fear mistakes. You will know failure. Continue to reach out.,https://www.brainyquote.com/quotes/benjamin_franklin_119119?src=t_failure,Benjamin Franklin,https://www.brainyquote.com/authors/benjamin-franklin-quotes
It is not because the truth is too difficult to see that we make mistakes... we make mistakes because the easiest and most comfortable course for us is to seek insight where it accords with our emotions - especially selfish ones.,https://www.brainyquote.com/quotes/aleksandr_solzhenitsyn_132503?src=t_failure,Aleksandr Solzhenitsyn,https://www.brainyquote.com/authors/aleksandr-solzhenitsyn-quotes
"My fault, my failure, is not in the passions I have, but in my lack of control of them.",https://www.brainyquote.com/quotes/jack_kerouac_385711?src=t_failure,Jack Kerouac,https://www.brainyquote.com/authors/jack-kerouac-quotes
You make mistakes. Mistakes don't make you.,https://www.brainyquote.com/quotes/maxwell_maltz_379028?src=t_failure,Maxwell Maltz,https://www.brainyquote.com/authors/maxwell-maltz-quotes
Failure happens all the time. It happens every day in practice. What makes you better is how you react to it.,https://www.brainyquote.com/quotes/mia_hamm_204539?src=t_failure,Mia Hamm,https://www.brainyquote.com/authors/mia-hamm-quotes
Our best successes often come after our greatest disappointments.,https://www.brainyquote.com/quotes/henry_ward_beecher_143089?src=t_failure,Henry Ward Beecher,https://www.brainyquote.com/authors/henry-ward-beecher-quotes
I hate to be a failure. I hate and regret the failure of my marriages. I would gladly give all my millions for just one lasting marital success.,https://www.brainyquote.com/quotes/j_paul_getty_150862?src=t_failure,J. Paul Getty,https://www.brainyquote.com/authors/j-paul-getty-quotes
There are some defeats more triumphant than victories.,https://www.brainyquote.com/quotes/michel_de_montaigne_103821?src=t_failure,Michel de Montaigne,https://www.brainyquote.com/authors/michel-de-montaigne-quotes
"If you're doing your best, you won't have any time to worry about failure.",https://www.brainyquote.com/quotes/h_jackson_brown_jr_384403?src=t_failure,"H. Jackson Brown, Jr.",https://www.brainyquote.com/authors/h-jackson-brown-jr-quotes
Failure is impossible.,https://www.brainyquote.com/quotes/susan_b_anthony_100488?src=t_failure,Susan B. Anthony,https://www.brainyquote.com/authors/susan-b-anthony-quotes
My life has been nothing but a failure.,https://www.brainyquote.com/quotes/claude_monet_176115?src=t_failure,Claude Monet,https://www.brainyquote.com/authors/claude-monet-quotes
Losing is no disgrace if you've given your best.,https://www.brainyquote.com/quotes/jim_palmer_182793?src=t_failure,Jim Palmer,https://www.brainyquote.com/authors/jim-palmer-quotes
Success isn't permanent and failure isn't fatal.,https://www.brainyquote.com/quotes/mike_ditka_357619?src=t_failure,Mike Ditka,https://www.brainyquote.com/authors/mike-ditka-quotes
Failure is always an option.,https://www.brainyquote.com/quotes/adam_savage_207580?src=t_failure,Adam Savage,https://www.brainyquote.com/authors/adam-savage-quotes
"One's only rival is one's own potentialities. One's only failure is failing to live up to one's own possibilities. In this sense, every man can be a king, and must therefore be treated like a king.",https://www.brainyquote.com/quotes/abraham_maslow_179911?src=t_failure,Abraham Maslow,https://www.brainyquote.com/authors/abraham-maslow-quotes
"Failure is not a single, cataclysmic event. You don't fail overnight. Instead, failure is a few errors in judgement, repeated every day.",https://www.brainyquote.com/quotes/jim_rohn_392765?src=t_failure,Jim Rohn,https://www.brainyquote.com/authors/jim-rohn-quotes
Sometimes the best gain is to lose.,https://www.brainyquote.com/quotes/george_herbert_379990?src=t_failure,George Herbert,https://www.brainyquote.com/authors/george-herbert-quotes
"If at first you don't succeed, failure may be your style.",https://www.brainyquote.com/quotes/quentin_crisp_108001?src=t_failure,Quentin Crisp,https://www.brainyquote.com/authors/quentin-crisp-quotes
