quote,quote_url,author,author_url
"You don't choose your family. They are God's gift to you, as you are to them.",https://www.brainyquote.com/quotes/desmond_tutu_112366?src=t_family,Desmond Tutu,https://www.brainyquote.com/authors/desmond-tutu-quotes
"The bond that links your true family is not one of blood, but of respect and joy in each other's life.",https://www.brainyquote.com/quotes/richard_bach_134891?src=t_family,Richard Bach,https://www.brainyquote.com/authors/richard-bach-quotes
"In every conceivable manner, the family is link to our past, bridge to our future.",https://www.brainyquote.com/quotes/alex_haley_391545?src=t_family,Alex Haley,https://www.brainyquote.com/authors/alex-haley-quotes
Family is not an important thing. It's everything.,https://www.brainyquote.com/quotes/michael_j_fox_189302?src=t_family,Michael J. Fox,https://www.brainyquote.com/authors/michael-j-fox-quotes
The love of family and the admiration of friends is much more important than wealth and privilege.,https://www.brainyquote.com/quotes/charles_kuralt_364308?src=t_family,Charles Kuralt,https://www.brainyquote.com/authors/charles-kuralt-quotes
Your children are not your children. They are the sons and daughters of Life's longing for itself. They came through you but not from you and though they are with you yet they belong not to you.,https://www.brainyquote.com/quotes/khalil_gibran_166623?src=t_family,Khalil Gibran,https://www.brainyquote.com/authors/khalil-gibran-quotes
"Without a family, man, alone in the world, trembles with the cold.",https://www.brainyquote.com/quotes/andre_maurois_115810?src=t_family,Andre Maurois,https://www.brainyquote.com/authors/andre-maurois-quotes
My family is my strength and my weakness.,https://www.brainyquote.com/quotes/aishwarya_rai_bachchan_180644?src=t_family,Aishwarya Rai Bachchan,https://www.brainyquote.com/authors/aishwarya-rai-bachchan-quotes
"If a country is to be corruption free and become a nation of beautiful minds, I strongly feel there are three key societal members who can make a difference. They are the father, the mother and the teacher.",https://www.brainyquote.com/quotes/a_p_j_abdul_kalam_178502?src=t_family,A. P. J. Abdul Kalam,https://www.brainyquote.com/authors/a-p-j-abdul-kalam-quotes
"For there is no friend like a sister in calm or stormy weather; To cheer one on the tedious way, to fetch one if one goes astray, to lift one if one totters down, to strengthen whilst one stands.",https://www.brainyquote.com/quotes/christina_rossetti_165077?src=t_family,Christina Rossetti,https://www.brainyquote.com/authors/christina-rossetti-quotes
I think togetherness is a very important ingredient to family life.,https://www.brainyquote.com/quotes/barbara_bush_383682?src=t_family,Barbara Bush,https://www.brainyquote.com/authors/barbara-bush-quotes
Family is the most important thing in the world.,https://www.brainyquote.com/quotes/princess_diana_200374?src=t_family,Princess Diana,https://www.brainyquote.com/authors/princess-diana-quotes
A happy family is but an earlier heaven.,https://www.brainyquote.com/quotes/george_bernard_shaw_118101?src=t_family,George Bernard Shaw,https://www.brainyquote.com/authors/george-bernard-shaw-quotes
Family means no one gets left behind or forgotten.,https://www.brainyquote.com/quotes/david_ogden_stiers_331251?src=t_family,David Ogden Stiers,https://www.brainyquote.com/authors/david-ogden-stiers-quotes
A family can develop only with a loving woman as its center.,https://www.brainyquote.com/quotes/karl_wilhelm_friedrich_sc_400081?src=t_family,Karl Wilhelm Friedrich Schlegel,https://www.brainyquote.com/authors/karl-wilhelm-friedrich-sc-quotes
The family is one of nature's masterpieces.,https://www.brainyquote.com/quotes/george_santayana_137423?src=t_family,George Santayana,https://www.brainyquote.com/authors/george-santayana-quotes
One's family is the most important thing in life. I look at it this way: One of these days I'll be over in a hospital somewhere with four walls around me. And the only people who'll be with me will be my family.,https://www.brainyquote.com/quotes/robert_byrd_111028?src=t_family,Robert Byrd,https://www.brainyquote.com/authors/robert-byrd-quotes
"A family is a risky venture, because the greater the love, the greater the loss... That's the trade-off. But I'll take it all.",https://www.brainyquote.com/quotes/brad_pitt_463944?src=t_family,Brad Pitt,https://www.brainyquote.com/authors/brad-pitt-quotes
"Feelings of worth can flourish only in an atmosphere where individual differences are appreciated, mistakes are tolerated, communication is open, and rules are flexible - the kind of atmosphere that is found in a nurturing family.",https://www.brainyquote.com/quotes/virginia_satir_175186?src=t_family,Virginia Satir,https://www.brainyquote.com/authors/virginia-satir-quotes
"I believe the world is one big family, and we need to help each other.",https://www.brainyquote.com/quotes/jet_li_377538?src=t_family,Jet Li,https://www.brainyquote.com/authors/jet-li-quotes
"I have frequently been questioned, especially by women, of how I could reconcile family life with a scientific career. Well, it has not been easy.",https://www.brainyquote.com/quotes/marie_curie_398323?src=t_family,Marie Curie,https://www.brainyquote.com/authors/marie-curie-quotes
The family is the test of freedom; because the family is the only thing that the free man makes for himself and by himself.,https://www.brainyquote.com/quotes/gilbert_k_chesterton_399138?src=t_family,Gilbert K. Chesterton,https://www.brainyquote.com/authors/gilbert-k-chesterton-quotes
The family is the first essential cell of human society.,https://www.brainyquote.com/quotes/pope_john_xxiii_114680?src=t_family,Pope John XXIII,https://www.brainyquote.com/authors/pope-john-xxiii-quotes
"When trouble comes, it's your family that supports you.",https://www.brainyquote.com/quotes/guy_lafleur_355831?src=t_family,Guy Lafleur,https://www.brainyquote.com/authors/guy-lafleur-quotes
Insanity runs in my family. It practically gallops.,https://www.brainyquote.com/quotes/cary_grant_379443?src=t_family,Cary Grant,https://www.brainyquote.com/authors/cary-grant-quotes
Some of the most important conversations I've ever had occurred at my family's dinner table.,https://www.brainyquote.com/quotes/bob_ehrlich_265653?src=t_family,Bob Ehrlich,https://www.brainyquote.com/authors/bob-ehrlich-quotes
"Sister is probably the most competitive relationship within the family, but once the sisters are grown, it becomes the strongest relationship.",https://www.brainyquote.com/quotes/margaret_mead_393230?src=t_family,Margaret Mead,https://www.brainyquote.com/authors/margaret-mead-quotes
"There's nothing I value more than the closeness of friends and family, a smile as I pass someone on the street.",https://www.brainyquote.com/quotes/willie_stargell_370755?src=t_family,Willie Stargell,https://www.brainyquote.com/authors/willie-stargell-quotes
"The only rock I know that stays steady, the only institution I know that works, is the family.",https://www.brainyquote.com/quotes/lee_iacocca_138664?src=t_family,Lee Iacocca,https://www.brainyquote.com/authors/lee-iacocca-quotes
There is no such thing as fun for the whole family.,https://www.brainyquote.com/quotes/jerry_seinfeld_379236?src=t_family,Jerry Seinfeld,https://www.brainyquote.com/authors/jerry-seinfeld-quotes
"Family, nature and health all go together.",https://www.brainyquote.com/quotes/olivia_newtonjohn_127167?src=t_family,Olivia Newton-John,https://www.brainyquote.com/authors/olivia-newton-john-quotes
"Family quarrels are bitter things. They don't go according to any rules. They're not like aches or wounds, they're more like splits in the skin that won't heal because there's not enough material.",https://www.brainyquote.com/quotes/f_scott_fitzgerald_113268?src=t_family,F. Scott Fitzgerald,https://www.brainyquote.com/authors/f-scott-fitzgerald-quotes
"He who is overly attached to his family members experiences fear and sorrow, for the root of all grief is attachment. Thus one should discard attachment to be happy.",https://www.brainyquote.com/quotes/chanakya_403206?src=t_family,Chanakya,https://www.brainyquote.com/authors/chanakya-quotes
Women's natural role is to be a pillar of the family.,https://www.brainyquote.com/quotes/grace_kelly_274306?src=t_family,Grace Kelly,https://www.brainyquote.com/authors/grace-kelly-quotes
Children are the keys of paradise.,https://www.brainyquote.com/quotes/eric_hoffer_117901?src=t_family,Eric Hoffer,https://www.brainyquote.com/authors/eric-hoffer-quotes
The other night I ate at a real nice family restaurant. Every table had an argument going.,https://www.brainyquote.com/quotes/george_carlin_156619?src=t_family,George Carlin,https://www.brainyquote.com/authors/george-carlin-quotes
The family you come from isn't as important as the family you're going to have.,https://www.brainyquote.com/quotes/ring_lardner_390023?src=t_family,Ring Lardner,https://www.brainyquote.com/authors/ring-lardner-quotes
A family is a place where principles are hammered and honed on the anvil of everyday living.,https://www.brainyquote.com/quotes/charles_r_swindoll_155778?src=t_family,Charles R. Swindoll,https://www.brainyquote.com/authors/charles-r-swindoll-quotes
A man should never neglect his family for business.,https://www.brainyquote.com/quotes/walt_disney_131654?src=t_family,Walt Disney,https://www.brainyquote.com/authors/walt-disney-quotes
One of the things that binds us as a family is a shared sense of humor.,https://www.brainyquote.com/quotes/ralph_fiennes_328930?src=t_family,Ralph Fiennes,https://www.brainyquote.com/authors/ralph-fiennes-quotes
"I woke up one morning thinking about wolves and realized that wolf packs function as families. Everyone has a role, and if you act within the parameters of your role, the whole pack succeeds, and when that falls apart, so does the pack.",https://www.brainyquote.com/quotes/jodi_picoult_429302?src=t_family,Jodi Picoult,https://www.brainyquote.com/authors/jodi-picoult-quotes
"My father used to play with my brother and me in the yard. Mother would come out and say, 'You're tearing up the grass'; 'We're not raising grass,' Dad would reply. 'We're raising boys.'",https://www.brainyquote.com/quotes/harmon_killebrew_105101?src=t_family,Harmon Killebrew,https://www.brainyquote.com/authors/harmon-killebrew-quotes
"I'll never stop dreaming that one day we can be a real family, together, all of us laughing and talking, loving and understanding, not looking at the past but only to the future.",https://www.brainyquote.com/quotes/latoya_jackson_258275?src=t_family,LaToya Jackson,https://www.brainyquote.com/authors/latoya-jackson-quotes
"You leave home to seek your fortune and, when you get it, you go home and share it with your family.",https://www.brainyquote.com/quotes/anita_baker_381079?src=t_family,Anita Baker,https://www.brainyquote.com/authors/anita-baker-quotes
I'm thankful to God for having a family that's been there for me. He's been there from the time I was a child to even now with my family helping with my little boy. It's worth more than words could ever describe. That's one of the ways I've been able to stay grounded is thanks to family and God.,https://www.brainyquote.com/quotes/ashton_shepherd_522896?src=t_family,Ashton Shepherd,https://www.brainyquote.com/authors/ashton-shepherd-quotes
Spend some time this weekend on home improvement; improve your attitude toward your family.,https://www.brainyquote.com/quotes/bo_bennett_167546?src=t_family,Bo Bennett,https://www.brainyquote.com/authors/bo-bennett-quotes
The greatest thing in family life is to take a hint when a hint is intended-and not to take a hint when a hint isn't intended.,https://www.brainyquote.com/quotes/robert_frost_116806?src=t_family,Robert Frost,https://www.brainyquote.com/authors/robert-frost-quotes
"I have a great family, I live an amazing life.",https://www.brainyquote.com/quotes/john_oates_285768?src=t_family,John Oates,https://www.brainyquote.com/authors/john-oates-quotes
People are pretty forgiving when it comes to other people's families. The only family that ever horrifies you is your own.,https://www.brainyquote.com/quotes/douglas_coupland_411371?src=t_family,Douglas Coupland,https://www.brainyquote.com/authors/douglas-coupland-quotes
My family comes first. Maybe that's what makes me different from other guys.,https://www.brainyquote.com/quotes/bobby_darin_314921?src=t_family,Bobby Darin,https://www.brainyquote.com/authors/bobby-darin-quotes
My family was my guide to my reality.,https://www.brainyquote.com/quotes/haywood_nelson_261690?src=t_family,Haywood Nelson,https://www.brainyquote.com/authors/haywood-nelson-quotes
I've always put my family first and that's just the way it is.,https://www.brainyquote.com/quotes/jamie_lee_curtis_360548?src=t_family,Jamie Lee Curtis,https://www.brainyquote.com/authors/jamie-lee-curtis-quotes
"I'm pretty much a good Catholic girl at heart and I believe in family. I also have a basic belief that God takes care of me. I believe in prayer, even though I'm not that religious. I just have that foundation from my family. I mean when you think that you're just a human being and one of God's creatures, you can't take anything that seriously.",https://www.brainyquote.com/quotes/catherine_ohara_411673?src=t_family,Catherine O'Hara,https://www.brainyquote.com/authors/catherine-ohara-quotes
A home with a loving and loyal husband and wife is the supreme setting in which children can be reared in love and righteousness and in which the spiritual and physical needs of children can be met.,https://www.brainyquote.com/quotes/david_a_bednar_590750?src=t_family,David A. Bednar,https://www.brainyquote.com/authors/david-a-bednar-quotes
Dignity is not negotiable. Dignity is the honor of the family.,https://www.brainyquote.com/quotes/vartan_gregorian_113687?src=t_family,Vartan Gregorian,https://www.brainyquote.com/authors/vartan-gregorian-quotes
Having family responsibilities and concerns just has to make you a more understanding person.,https://www.brainyquote.com/quotes/sandra_day_oconnor_166894?src=t_family,Sandra Day O'Connor,https://www.brainyquote.com/authors/sandra-day-oconnor-quotes
I stay in tune with my family and God.,https://www.brainyquote.com/quotes/regina_king_387871?src=t_family,Regina King,https://www.brainyquote.com/authors/regina-king-quotes
"A woman can take care of the family. It takes a man to provide structure, to provide stability.",https://www.brainyquote.com/quotes/tom_delay_160299?src=t_family,Tom DeLay,https://www.brainyquote.com/authors/tom-delay-quotes
Whatever else is unsure in this stinking dunghill of a world a mother's love is not.,https://www.brainyquote.com/quotes/james_joyce_385430?src=t_family,James Joyce,https://www.brainyquote.com/authors/james-joyce-quotes
Maybe there is no actual place called hell. Maybe hell is just having to listen to our grandparents breathe through their noses when they're eating sandwiches.,https://www.brainyquote.com/quotes/jim_carrey_128276?src=t_family,Jim Carrey,https://www.brainyquote.com/authors/jim-carrey-quotes
