quote,quote_url,author,author_url
The ultimate tragedy is not the oppression and cruelty by the bad people but the silence over that by the good people.,https://www.brainyquote.com/quotes/martin_luther_king_jr_390143?src=t_good,"Martin Luther King, Jr.",https://www.brainyquote.com/authors/martin-luther-king-jr-quotes
The only thing necessary for the triumph of evil is for good men to do nothing.,https://www.brainyquote.com/quotes/edmund_burke_377528?src=t_good,Edmund Burke,https://www.brainyquote.com/authors/edmund-burke-quotes
There is nothing either good or bad but thinking makes it so.,https://www.brainyquote.com/quotes/william_shakespeare_109527?src=t_good,William Shakespeare,https://www.brainyquote.com/authors/william-shakespeare-quotes
Don't be afraid to give up the good to go for the great.,https://www.brainyquote.com/quotes/john_d_rockefeller_119902?src=t_good,John D. Rockefeller,https://www.brainyquote.com/authors/john-d-rockefeller-quotes
"Goodness is about character - integrity, honesty, kindness, generosity, moral courage, and the like. More than anything else, it is about how we treat other people.",https://www.brainyquote.com/quotes/dennis_prager_471259?src=t_good,Dennis Prager,https://www.brainyquote.com/authors/dennis-prager-quotes
"Despite everything, I believe that people are really good at heart.",https://www.brainyquote.com/quotes/anne_frank_109060?src=t_good,Anne Frank,https://www.brainyquote.com/authors/anne-frank-quotes
"Good judgment comes from experience, and a lot of that comes from bad judgment.",https://www.brainyquote.com/quotes/will_rogers_411692?src=t_good,Will Rogers,https://www.brainyquote.com/authors/will-rogers-quotes
"Good people do not need laws to tell them to act responsibly, while bad people will find a way around the laws.",https://www.brainyquote.com/quotes/plato_161536?src=t_good,Plato,https://www.brainyquote.com/authors/plato-quotes
"If you can't make it good, at least make it look good.",https://www.brainyquote.com/quotes/bill_gates_382270?src=t_good,Bill Gates,https://www.brainyquote.com/authors/bill-gates-quotes
"When I'm good, I'm very good. But when I'm bad I'm better.",https://www.brainyquote.com/quotes/mae_west_137976?src=t_good,Mae West,https://www.brainyquote.com/authors/mae-west-quotes
The true measure of a man is how he treats someone who can do him absolutely no good.,https://www.brainyquote.com/quotes/samuel_johnson_103605?src=t_good,Samuel Johnson,https://www.brainyquote.com/authors/samuel-johnson-quotes
The fragrance of flowers spreads only in the direction of the wind. But the goodness of a person spreads in all directions.,https://www.brainyquote.com/quotes/chanakya_201071?src=t_good,Chanakya,https://www.brainyquote.com/authors/chanakya-quotes
"The more we come out and do good to others, the more our hearts will be purified, and God will be in them.",https://www.brainyquote.com/quotes/swami_vivekananda_381889?src=t_good,Swami Vivekananda,https://www.brainyquote.com/authors/swami-vivekananda-quotes
Every man is guilty of all the good he did not do.,https://www.brainyquote.com/quotes/voltaire_132939?src=t_good,Voltaire,https://www.brainyquote.com/authors/voltaire-quotes
"But I say to you, Love your enemies and pray for those who persecute you, so that you may be sons of your Father who is in heaven; for he makes his sun rise on the evil and on the good, and sends rain on the just and on the unjust.",https://www.brainyquote.com/quotes/jesus_christ_425192?src=t_good,Jesus Christ,https://www.brainyquote.com/authors/jesus-christ-quotes
A good beginning makes a good end.,https://www.brainyquote.com/quotes/louis_lamour_162932?src=t_good,Louis L'Amour,https://www.brainyquote.com/authors/louis-lamour-quotes
"It takes many good deeds to build a good reputation, and only one bad one to lose it.",https://www.brainyquote.com/quotes/benjamin_franklin_385547?src=t_good,Benjamin Franklin,https://www.brainyquote.com/authors/benjamin-franklin-quotes
"Be sweet, be good, and honest always.",https://www.brainyquote.com/quotes/emma_bunton_129498?src=t_good,Emma Bunton,https://www.brainyquote.com/authors/emma-bunton-quotes
"If people are good only because they fear punishment, and hope for reward, then we are a sorry lot indeed.",https://www.brainyquote.com/quotes/albert_einstein_109022?src=t_good,Albert Einstein,https://www.brainyquote.com/authors/albert-einstein-quotes
Goodness is the only investment that never fails.,https://www.brainyquote.com/quotes/henry_david_thoreau_106122?src=t_good,Henry David Thoreau,https://www.brainyquote.com/authors/henry-david-thoreau-quotes
"I object to violence because when it appears to do good, the good is only temporary; the evil it does is permanent.",https://www.brainyquote.com/quotes/mahatma_gandhi_125824?src=t_good,Mahatma Gandhi,https://www.brainyquote.com/authors/mahatma-gandhi-quotes
"To be a good citizen, it's important to be able to put yourself in other people's shoes and see the big picture. If everything you see is rooted in your own identity, that becomes difficult or impossible.",https://www.brainyquote.com/quotes/eli_pariser_550953?src=t_good,Eli Pariser,https://www.brainyquote.com/authors/eli-pariser-quotes
Good things do not come easy. The road is lined with pitfalls.,https://www.brainyquote.com/quotes/desi_arnaz_321382?src=t_good,Desi Arnaz,https://www.brainyquote.com/authors/desi-arnaz-quotes
"A good character is the best tombstone. Those who loved you and were helped by you will remember you when forget-me-nots have withered. Carve your name on hearts, not on marble.",https://www.brainyquote.com/quotes/charles_spurgeon_106282?src=t_good,Charles Spurgeon,https://www.brainyquote.com/authors/charles-spurgeon-quotes
"Associate yourself with people of good quality, for it is better to be alone than in bad company.",https://www.brainyquote.com/quotes/booker_t_washington_130024?src=t_good,Booker T. Washington,https://www.brainyquote.com/authors/booker-t-washington-quotes
The good old days are now.,https://www.brainyquote.com/quotes/tom_clancy_290223?src=t_good,Tom Clancy,https://www.brainyquote.com/authors/tom-clancy-quotes
"I'm convinced of this: Good done anywhere is good done everywhere. For a change, start by speaking to people rather than walking by them like they're stones that don't matter. As long as you're breathing, it's never too late to do some good.",https://www.brainyquote.com/quotes/maya_angelou_578849?src=t_good,Maya Angelou,https://www.brainyquote.com/authors/maya-angelou-quotes
I'd rather be lucky than good.,https://www.brainyquote.com/quotes/lefty_gomez_139632?src=t_good,Lefty Gomez,https://www.brainyquote.com/authors/lefty-gomez-quotes
A true friend is someone who thinks that you are a good egg even though he knows that you are slightly cracked.,https://www.brainyquote.com/quotes/bernard_meltzer_157507?src=t_good,Bernard Meltzer,https://www.brainyquote.com/authors/bernard-meltzer-quotes
Life comes from physical survival; but the good life comes from what we care about.,https://www.brainyquote.com/quotes/rollo_may_158695?src=t_good,Rollo May,https://www.brainyquote.com/authors/rollo-may-quotes
Fun is good.,https://www.brainyquote.com/quotes/dr_seuss_109926?src=t_good,Dr. Seuss,https://www.brainyquote.com/authors/dr-seuss-quotes
"There are three ingredients in the good life: learning, earning and yearning.",https://www.brainyquote.com/quotes/christopher_morley_116204?src=t_good,Christopher Morley,https://www.brainyquote.com/authors/christopher-morley-quotes
In every age 'the good old days' were a myth. No one ever thought they were good at the time. For every age has consisted of crises that seemed intolerable to the people who lived through them.,https://www.brainyquote.com/quotes/brooks_atkinson_133307?src=t_good,Brooks Atkinson,https://www.brainyquote.com/authors/brooks-atkinson-quotes
"A man is called selfish not for pursuing his own good, but for neglecting his neighbor's.",https://www.brainyquote.com/quotes/richard_whately_105702?src=t_good,Richard Whately,https://www.brainyquote.com/authors/richard-whately-quotes
The good and the wise lead quiet lives.,https://www.brainyquote.com/quotes/euripides_133713?src=t_good,Euripides,https://www.brainyquote.com/authors/euripides-quotes
No one can be good for long if goodness is not in demand.,https://www.brainyquote.com/quotes/bertolt_brecht_149468?src=t_good,Bertolt Brecht,https://www.brainyquote.com/authors/bertolt-brecht-quotes
A good scare is worth more to a man than good advice.,https://www.brainyquote.com/quotes/e_w_howe_103889?src=t_good,E. W. Howe,https://www.brainyquote.com/authors/e-w-howe-quotes
"A man has to live with himself, and he should see to it that he always has good company.",https://www.brainyquote.com/quotes/charles_evans_hughes_106106?src=t_good,Charles Evans Hughes,https://www.brainyquote.com/authors/charles-evans-hughes-quotes
A man who is good enough to shed his blood for the country is good enough to be given a square deal afterwards.,https://www.brainyquote.com/quotes/theodore_roosevelt_147882?src=t_good,Theodore Roosevelt,https://www.brainyquote.com/authors/theodore-roosevelt-quotes
Less is only more where more is no good.,https://www.brainyquote.com/quotes/frank_lloyd_wright_100204?src=t_good,Frank Lloyd Wright,https://www.brainyquote.com/authors/frank-lloyd-wright-quotes
Have a very good reason for everything you do.,https://www.brainyquote.com/quotes/laurence_olivier_106177?src=t_good,Laurence Olivier,https://www.brainyquote.com/authors/laurence-olivier-quotes
The chief enemy of creativity is 'good' sense.,https://www.brainyquote.com/quotes/pablo_picasso_110182?src=t_good,Pablo Picasso,https://www.brainyquote.com/authors/pablo-picasso-quotes
He who stops being better stops being good.,https://www.brainyquote.com/quotes/oliver_cromwell_130154?src=t_good,Oliver Cromwell,https://www.brainyquote.com/authors/oliver-cromwell-quotes
"Learn to... be what you are, and learn to resign with a good grace all that you are not.",https://www.brainyquote.com/quotes/henri_frederic_amiel_104285?src=t_good,Henri Frederic Amiel,https://www.brainyquote.com/authors/henri-frederic-amiel-quotes
"The word 'good' has many meanings. For example, if a man were to shoot his grandmother at a range of five hundred yards, I should call him a good shot, but not necessarily a good man.",https://www.brainyquote.com/quotes/gilbert_k_chesterton_106350?src=t_good,Gilbert K. Chesterton,https://www.brainyquote.com/authors/gilbert-k-chesterton-quotes
The omission of good is no less reprehensible than the commission of evil.,https://www.brainyquote.com/quotes/plutarch_134916?src=t_good,Plutarch,https://www.brainyquote.com/authors/plutarch-quotes
"On the whole, human beings want to be good, but not too good, and not quite all the time.",https://www.brainyquote.com/quotes/george_orwell_100360?src=t_good,George Orwell,https://www.brainyquote.com/authors/george-orwell-quotes
It takes a great man to be a good listener.,https://www.brainyquote.com/quotes/calvin_coolidge_101586?src=t_good,Calvin Coolidge,https://www.brainyquote.com/authors/calvin-coolidge-quotes
All good things which exist are the fruits of originality.,https://www.brainyquote.com/quotes/john_stuart_mill_124639?src=t_good,John Stuart Mill,https://www.brainyquote.com/authors/john-stuart-mill-quotes
There has to be evil so that good can prove its purity above it.,https://www.brainyquote.com/quotes/unknown_383254?src=t_good,Unknown,https://www.brainyquote.com/authors/unknown-quotes
Good advice is something a man gives when he is too old to set a bad example.,https://www.brainyquote.com/quotes/francois_de_la_rochefouca_109240?src=t_good,Francois de La Rochefoucauld,https://www.brainyquote.com/authors/francois-de-la-rochefouca-quotes
A good indignation brings out all one's powers.,https://www.brainyquote.com/quotes/ralph_waldo_emerson_118310?src=t_good,Ralph Waldo Emerson,https://www.brainyquote.com/authors/ralph-waldo-emerson-quotes
"The crest and crowning of all good, Life's final star, is brotherhood.",https://www.brainyquote.com/quotes/edwin_markham_132362?src=t_good,Edwin Markham,https://www.brainyquote.com/authors/edwin-markham-quotes
The 'good old times' - all times when old are good.,https://www.brainyquote.com/quotes/lord_byron_133304?src=t_good,Lord Byron,https://www.brainyquote.com/authors/lord-byron-quotes
I have made good judgments in the past. I have made good judgments in the future.,https://www.brainyquote.com/quotes/dan_quayle_102906?src=t_good,Dan Quayle,https://www.brainyquote.com/authors/dan-quayle-quotes
It's good to shut up sometimes.,https://www.brainyquote.com/quotes/marcel_marceau_101346?src=t_good,Marcel Marceau,https://www.brainyquote.com/authors/marcel-marceau-quotes
"That which is striking and beautiful is not always good, but that which is good is always beautiful.",https://www.brainyquote.com/quotes/ninon_de_lenclos_161590?src=t_good,Ninon de L'Enclos,https://www.brainyquote.com/authors/ninon-de-lenclos-quotes
I know that every good and excellent thing in the world stands moment by moment on the razor-edge of danger and must be fought for.,https://www.brainyquote.com/quotes/thornton_wilder_101475?src=t_good,Thornton Wilder,https://www.brainyquote.com/authors/thornton-wilder-quotes
"Good men are the stars, the planets of the ages wherein they live, and illustrate the times.",https://www.brainyquote.com/quotes/ben_jonson_386177?src=t_good,Ben Jonson,https://www.brainyquote.com/authors/ben-jonson-quotes
"No man or woman can be strong, gentle, pure, and good, without the world being better for it and without someone being helped and comforted by the very existence of that goodness.",https://www.brainyquote.com/quotes/phillips_brooks_149499?src=t_good,Phillips Brooks,https://www.brainyquote.com/authors/phillips-brooks-quotes
