quote,quote_url,author,author_url
"My mother said to me, 'If you are a soldier, you will become a general. If you are a monk, you will become the Pope.' Instead, I was a painter, and became Picasso.",https://www.brainyquote.com/quotes/pablo_picasso_128290?src=t_mom,Pablo Picasso,https://www.brainyquote.com/authors/pablo-picasso-quotes
"Having children is my greatest achievement. It was my saviour. It switched my focus from the outside to the inside. My children are gifts, they remind me of what's important.",https://www.brainyquote.com/quotes/elle_macpherson_330373?src=t_mom,Elle Macpherson,https://www.brainyquote.com/authors/elle-macpherson-quotes
An ounce of mother is worth a pound of clergy.,https://www.brainyquote.com/quotes/rudyard_kipling_162794?src=t_mom,Rudyard Kipling,https://www.brainyquote.com/authors/rudyard-kipling-quotes
"When you are a mother, you are never really alone in your thoughts. A mother always has to think twice, once for herself and once for her child.",https://www.brainyquote.com/quotes/sophia_loren_106851?src=t_mom,Sophia Loren,https://www.brainyquote.com/authors/sophia-loren-quotes
"My mother had a great deal of trouble with me, but I think she enjoyed it.",https://www.brainyquote.com/quotes/mark_twain_137899?src=t_mom,Mark Twain,https://www.brainyquote.com/authors/mark-twain-quotes
Mothers are fonder than fathers of their children because they are more certain they are their own.,https://www.brainyquote.com/quotes/aristotle_106852?src=t_mom,Aristotle,https://www.brainyquote.com/authors/aristotle-quotes
"When your mother asks, 'Do you want a piece of advice?' it is a mere formality. It doesn't matter if you answer yes or no. You're going to get it anyway.",https://www.brainyquote.com/quotes/erma_bombeck_136556?src=t_mom,Erma Bombeck,https://www.brainyquote.com/authors/erma-bombeck-quotes
"That strong mother doesn't tell her cub, Son, stay weak so the wolves can get you. She says, Toughen up, this is reality we are living in.",https://www.brainyquote.com/quotes/lauryn_hill_328441?src=t_mom,Lauryn Hill,https://www.brainyquote.com/authors/lauryn-hill-quotes
Men are what their mothers made them.,https://www.brainyquote.com/quotes/ralph_waldo_emerson_163760?src=t_mom,Ralph Waldo Emerson,https://www.brainyquote.com/authors/ralph-waldo-emerson-quotes
The heart of a mother is a deep abyss at the bottom of which you will always find forgiveness.,https://www.brainyquote.com/quotes/honore_de_balzac_145948?src=t_mom,Honore de Balzac,https://www.brainyquote.com/authors/honore-de-balzac-quotes
My mother thinks I am the best. And I was raised to always believe what my mother tells me.,https://www.brainyquote.com/quotes/diego_maradona_418709?src=t_mom,Diego Maradona,https://www.brainyquote.com/authors/diego-maradona-quotes
"My mother used to tell me man gives the award, God gives the reward. I don't need another plaque.",https://www.brainyquote.com/quotes/denzel_washington_337090?src=t_mom,Denzel Washington,https://www.brainyquote.com/authors/denzel-washington-quotes
"Sweater, n.: garment worn by child when its mother is feeling chilly.",https://www.brainyquote.com/quotes/ambrose_bierce_106850?src=t_mom,Ambrose Bierce,https://www.brainyquote.com/authors/ambrose-bierce-quotes
Motherhood is the greatest thing and the hardest thing.,https://www.brainyquote.com/quotes/ricki_lake_418440?src=t_mom,Ricki Lake,https://www.brainyquote.com/authors/ricki-lake-quotes
"Motherhood is a great honor and privilege, yet it is also synonymous with servanthood. Every day women are called upon to selflessly meet the needs of their families. Whether they are awake at night nursing a baby, spending their time and money on less-than-grateful teenagers, or preparing meals, moms continuously put others before themselves.",https://www.brainyquote.com/quotes/charles_stanley_451704?src=t_mom,Charles Stanley,https://www.brainyquote.com/authors/charles-stanley-quotes
"The natural state of motherhood is unselfishness. When you become a mother, you are no longer the center of your own universe. You relinquish that position to your children.",https://www.brainyquote.com/quotes/jessica_lange_364785?src=t_mom,Jessica Lange,https://www.brainyquote.com/authors/jessica-lange-quotes
"How simple a thing it seems to me that to know ourselves as we are, we must know our mothers names.",https://www.brainyquote.com/quotes/alice_walker_146803?src=t_mom,Alice Walker,https://www.brainyquote.com/authors/alice-walker-quotes
My mother taught me to treat a lady respectfully.,https://www.brainyquote.com/quotes/chris_brown_410549?src=t_mom,Chris Brown,https://www.brainyquote.com/authors/chris-brown-quotes
Only God Himself fully appreciates the influence of a Christian mother in the molding of character in her children.,https://www.brainyquote.com/quotes/billy_graham_389508?src=t_mom,Billy Graham,https://www.brainyquote.com/authors/billy-graham-quotes
The fastest way to break the cycle of perfectionism and become a fearless mother is to give up the idea of doing it perfectly - indeed to embrace uncertainty and imperfection.,https://www.brainyquote.com/quotes/arianna_huffington_395723?src=t_mom,Arianna Huffington,https://www.brainyquote.com/authors/arianna-huffington-quotes
"Some are kissing mothers and some are scolding mothers, but it is love just the same, and most mothers kiss and scold together.",https://www.brainyquote.com/quotes/pearl_s_buck_139029?src=t_mom,Pearl S. Buck,https://www.brainyquote.com/authors/pearl-s-buck-quotes
"I am sure that if the mothers of various nations could meet, there would be no more wars.",https://www.brainyquote.com/quotes/e_m_forster_385906?src=t_mom,E. M. Forster,https://www.brainyquote.com/authors/e-m-forster-quotes
The mother's heart is the child's schoolroom.,https://www.brainyquote.com/quotes/henry_ward_beecher_132986?src=t_mom,Henry Ward Beecher,https://www.brainyquote.com/authors/henry-ward-beecher-quotes
Mothers are all slightly insane.,https://www.brainyquote.com/quotes/j_d_salinger_380113?src=t_mom,J. D. Salinger,https://www.brainyquote.com/authors/j-d-salinger-quotes
Only mothers can think of the future - because they give birth to it in their children.,https://www.brainyquote.com/quotes/maxim_gorky_138731?src=t_mom,Maxim Gorky,https://www.brainyquote.com/authors/maxim-gorky-quotes
Mother is far too clever to understand anything she does not like.,https://www.brainyquote.com/quotes/arnold_bennett_149645?src=t_mom,Arnold Bennett,https://www.brainyquote.com/authors/arnold-bennett-quotes
My mother's wonderful. To me she's perfection.,https://www.brainyquote.com/quotes/michael_jackson_361186?src=t_mom,Michael Jackson,https://www.brainyquote.com/authors/michael-jackson-quotes
What greater aspiration and challenge are there for a mother than the hope of raising a great son or daughter?,https://www.brainyquote.com/quotes/rose_kennedy_502440?src=t_mom,Rose Kennedy,https://www.brainyquote.com/authors/rose-kennedy-quotes
My mom has made it possible for me to be who I am. Our family is everything. Her greatest skill was encouraging me to find my own person and own independence.,https://www.brainyquote.com/quotes/charlize_theron_425927?src=t_mom,Charlize Theron,https://www.brainyquote.com/authors/charlize-theron-quotes
The woman is uniformly sacrificed to the wife and mother.,https://www.brainyquote.com/quotes/elizabeth_cady_stanton_382571?src=t_mom,Elizabeth Cady Stanton,https://www.brainyquote.com/authors/elizabeth-cady-stanton-quotes
"The biggest surprise, which is also the best, is that I didn't know I would love motherhood as much as I do.",https://www.brainyquote.com/quotes/deborah_norville_434786?src=t_mom,Deborah Norville,https://www.brainyquote.com/authors/deborah-norville-quotes
"The mother-child relationship is paradoxical and, in a sense, tragic. It requires the most intense love on the mother's side, yet this very love must help the child grow away from the mother, and to become fully independent.",https://www.brainyquote.com/quotes/erich_fromm_139033?src=t_mom,Erich Fromm,https://www.brainyquote.com/authors/erich-fromm-quotes
Tired mothers find that spanking takes less time than reasoning and penetrates sooner to the seat of the memory.,https://www.brainyquote.com/quotes/will_durant_154364?src=t_mom,Will Durant,https://www.brainyquote.com/authors/will-durant-quotes
"A father may turn his back on his child, brothers and sisters may become inveterate enemies, husbands may desert their wives, wives their husbands. But a mother's love endures through all.",https://www.brainyquote.com/quotes/washington_irving_118505?src=t_mom,Washington Irving,https://www.brainyquote.com/authors/washington-irving-quotes
"Throughout my life, my mom has been the person that I've always looked up to.",https://www.brainyquote.com/quotes/mike_krzyzewski_295898?src=t_mom,Mike Krzyzewski,https://www.brainyquote.com/authors/mike-krzyzewski-quotes
"I was raised by a single mother who made a way for me. She used to scrub floors as a domestic worker, put a cleaning rag in her pocketbook and ride the subways in Brooklyn so I would have food on the table. But she taught me as I walked her to the subway that life is about not where you start, but where you're going. That's family values.",https://www.brainyquote.com/quotes/al_sharpton_411985?src=t_mom,Al Sharpton,https://www.brainyquote.com/authors/al-sharpton-quotes
"The man in our society is the breadwinner; the woman has enough to do as the homemaker, wife and mother.",https://www.brainyquote.com/quotes/dorothy_fields_336967?src=t_mom,Dorothy Fields,https://www.brainyquote.com/authors/dorothy-fields-quotes
"Every man must define his identity against his mother. If he does not, he just falls back into her and is swallowed up.",https://www.brainyquote.com/quotes/camille_paglia_159809?src=t_mom,Camille Paglia,https://www.brainyquote.com/authors/camille-paglia-quotes
The real menace in dealing with a five-year-old is that in no time at all you begin to sound like a five-year-old.,https://www.brainyquote.com/quotes/jean_kerr_104548?src=t_mom,Jean Kerr,https://www.brainyquote.com/authors/jean-kerr-quotes
"My mother taught me about the power of inspiration and courage, and she did it with a strength and a passion that I wish could be bottled.",https://www.brainyquote.com/quotes/carly_fiorina_394230?src=t_mom,Carly Fiorina,https://www.brainyquote.com/authors/carly-fiorina-quotes
Motherhood has a very humanizing effect. Everything gets reduced to essentials.,https://www.brainyquote.com/quotes/meryl_streep_135057?src=t_mom,Meryl Streep,https://www.brainyquote.com/authors/meryl-streep-quotes
I am truly my mother's son.,https://www.brainyquote.com/quotes/david_geffen_352572?src=t_mom,David Geffen,https://www.brainyquote.com/authors/david-geffen-quotes
"I owe much to mother. She had an expert's understanding, but also approached art emotionally.",https://www.brainyquote.com/quotes/david_rockefeller_253687?src=t_mom,David Rockefeller,https://www.brainyquote.com/authors/david-rockefeller-quotes
My sisters and mom raised me to respect women and open doors for them.,https://www.brainyquote.com/quotes/milo_ventimiglia_410521?src=t_mom,Milo Ventimiglia,https://www.brainyquote.com/authors/milo-ventimiglia-quotes
There are only two things a child will share willingly; communicable diseases and its mother's age.,https://www.brainyquote.com/quotes/benjamin_spock_128935?src=t_mom,Benjamin Spock,https://www.brainyquote.com/authors/benjamin-spock-quotes
"Motherhood is priced Of God, at price no man may dare To lessen or misunderstand.",https://www.brainyquote.com/quotes/helen_hunt_jackson_192254?src=t_mom,Helen Hunt Jackson,https://www.brainyquote.com/authors/helen-hunt-jackson-quotes
"A woman must combine the role of mother, wife and politician.",https://www.brainyquote.com/quotes/emma_bonino_372829?src=t_mom,Emma Bonino,https://www.brainyquote.com/authors/emma-bonino-quotes
It is not until you become a mother that your judgment slowly turns to compassion and understanding.,https://www.brainyquote.com/quotes/erma_bombeck_133153?src=t_mom,Erma Bombeck,https://www.brainyquote.com/authors/erma-bombeck-quotes
"My mother gave me a sense of independence, a sense of total confidence that we could do whatever it was we set out to do. That's how we were raised.",https://www.brainyquote.com/quotes/robin_wright_279630?src=t_mom,Robin Wright,https://www.brainyquote.com/authors/robin-wright-quotes
"I loved raising my kids. I loved the process, the dirt of it, the tears of it, the frustration of it, Christmas, Easter, birthdays, growth charts, pediatrician appointments. I loved all of it.",https://www.brainyquote.com/quotes/jane_elliot_480850?src=t_mom,Jane Elliot,https://www.brainyquote.com/authors/jane-elliot-quotes
Being a mother is hard and it wasn't a subject I ever studied.,https://www.brainyquote.com/quotes/ruby_wax_346423?src=t_mom,Ruby Wax,https://www.brainyquote.com/authors/ruby-wax-quotes
"Motherhood is the strangest thing, it can be like being one's own Trojan horse.",https://www.brainyquote.com/quotes/rebecca_west_384865?src=t_mom,Rebecca West,https://www.brainyquote.com/authors/rebecca-west-quotes
"My parents, especially my mother, were no influence on me whatsoever.",https://www.brainyquote.com/quotes/andy_partridge_291522?src=t_mom,Andy Partridge,https://www.brainyquote.com/authors/andy-partridge-quotes
"Clearly, society has a tremendous stake in insisting on a woman's natural fitness for the career of mother: the alternatives are all too expensive.",https://www.brainyquote.com/quotes/ann_oakley_159409?src=t_mom,Ann Oakley,https://www.brainyquote.com/authors/ann-oakley-quotes
"Mothers and children are human beings, and they will sometimes do the wrong thing.",https://www.brainyquote.com/quotes/maurice_sendak_474806?src=t_mom,Maurice Sendak,https://www.brainyquote.com/authors/maurice-sendak-quotes
Motherhood is the only thing in my life that I've really known for sure is something I wanted to do.,https://www.brainyquote.com/quotes/cynthia_nixon_445261?src=t_mom,Cynthia Nixon,https://www.brainyquote.com/authors/cynthia-nixon-quotes
"Morality and its victim, the mother - what a terrible picture! Is there indeed anything more terrible, more criminal, than our glorified sacred function of motherhood?",https://www.brainyquote.com/quotes/emma_goldman_150919?src=t_mom,Emma Goldman,https://www.brainyquote.com/authors/emma-goldman-quotes
I wanted to escape so badly. But of course I knew I couldn't just give up and leave school. It was only when I heard my mom's voice that I came out of my hiding place.,https://www.brainyquote.com/quotes/zhang_ziyi_281218?src=t_mom,Zhang Ziyi,https://www.brainyquote.com/authors/zhang-ziyi-quotes
Mothers are the necessity of invention.,https://www.brainyquote.com/quotes/bill_watterson_110096?src=t_mom,Bill Watterson,https://www.brainyquote.com/authors/bill-watterson-quotes
The Vatican is against surrogate mothers. Good thing they didn't have that rule when Jesus was born.,https://www.brainyquote.com/quotes/elayne_boosler_133608?src=t_mom,Elayne Boosler,https://www.brainyquote.com/authors/elayne-boosler-quotes
