quote,quote_url,author,author_url
In three words I can sum up everything I've learned about life: it goes on.,https://www.brainyquote.com/quotes/robert_frost_101059?src=t_moving_on,Robert Frost,https://www.brainyquote.com/authors/robert-frost-quotes
"Bad things do happen; how I respond to them defines my character and the quality of my life. I can choose to sit in perpetual sadness, immobilized by the gravity of my loss, or I can choose to rise from the pain and treasure the most precious gift I have - life itself.",https://www.brainyquote.com/quotes/walter_anderson_183075?src=t_moving_on,Walter Anderson,https://www.brainyquote.com/authors/walter-anderson-quotes
Every new beginning comes from some other beginning's end.,https://www.brainyquote.com/quotes/seneca_405078?src=t_moving_on,Seneca,https://www.brainyquote.com/authors/seneca-quotes
"Every day is a new day, and you'll never be able to find happiness if you don't move on.",https://www.brainyquote.com/quotes/carrie_underwood_471334?src=t_moving_on,Carrie Underwood,https://www.brainyquote.com/authors/carrie-underwood-quotes
"If you carry joy in your heart, you can heal any moment.",https://www.brainyquote.com/quotes/carlos_santana_454496?src=t_moving_on,Carlos Santana,https://www.brainyquote.com/authors/carlos-santana-quotes
"If you love somebody, let them go, for if they return, they were always yours. And if they don't, they never were.",https://www.brainyquote.com/quotes/khalil_gibran_143033?src=t_moving_on,Khalil Gibran,https://www.brainyquote.com/authors/khalil-gibran-quotes
"You build on failure. You use it as a stepping stone. Close the door on the past. You don't try to forget the mistakes, but you don't dwell on it. You don't let it have any of your energy, or any of your time, or any of your space.",https://www.brainyquote.com/quotes/johnny_cash_188009?src=t_moving_on,Johnny Cash,https://www.brainyquote.com/authors/johnny-cash-quotes
"It is by going down into the abyss that we recover the treasures of life. Where you stumble, there lies your treasure.",https://www.brainyquote.com/quotes/joseph_campbell_391580?src=t_moving_on,Joseph Campbell,https://www.brainyquote.com/authors/joseph-campbell-quotes
"It is only through labor and painful effort, by grim energy and resolute courage, that we move on to better things.",https://www.brainyquote.com/quotes/theodore_roosevelt_147887?src=t_moving_on,Theodore Roosevelt,https://www.brainyquote.com/authors/theodore-roosevelt-quotes
Blessed are the hearts that can bend; they shall never be broken.,https://www.brainyquote.com/quotes/albert_camus_383482?src=t_moving_on,Albert Camus,https://www.brainyquote.com/authors/albert-camus-quotes
"To help yourself, you must be yourself. Be the best that you can be. When you make a mistake, learn from it, pick yourself up and move on.",https://www.brainyquote.com/quotes/dave_pelzer_204767?src=t_moving_on,Dave Pelzer,https://www.brainyquote.com/authors/dave-pelzer-quotes
"Love one another and help others to rise to the higher levels, simply by pouring out love. Love is infectious and the greatest healing energy.",https://www.brainyquote.com/quotes/sai_baba_184102?src=t_moving_on,Sai Baba,https://www.brainyquote.com/authors/sai-baba-quotes
"It's time to say goodbye, but I think goodbyes are sad and I'd much rather say hello. Hello to a new adventure.",https://www.brainyquote.com/quotes/ernie_harwell_471958?src=t_moving_on,Ernie Harwell,https://www.brainyquote.com/authors/ernie-harwell-quotes
"Moving on, is a simple thing, what it leaves behind is hard.",https://www.brainyquote.com/quotes/dave_mustaine_182368?src=t_moving_on,Dave Mustaine,https://www.brainyquote.com/authors/dave-mustaine-quotes
"I tell you the past is a bucket of ashes, so live not in your yesterdays, no just for tomorrow, but in the here and now. Keep moving and forget the post mortems; and remember, no one can get the jump on the future.",https://www.brainyquote.com/quotes/carl_sandburg_156025?src=t_moving_on,Carl Sandburg,https://www.brainyquote.com/authors/carl-sandburg-quotes
"So long as the memory of certain beloved friends lives in my heart, I shall say that life is good.",https://www.brainyquote.com/quotes/helen_keller_386647?src=t_moving_on,Helen Keller,https://www.brainyquote.com/authors/helen-keller-quotes
"Don't dwell on what went wrong. Instead, focus on what to do next. Spend your energies on moving forward toward finding the answer.",https://www.brainyquote.com/quotes/denis_waitley_125834?src=t_moving_on,Denis Waitley,https://www.brainyquote.com/authors/denis-waitley-quotes
"The art of war is simple enough. Find out where your enemy is. Get at him as soon as you can. Strike him as hard as you can, and keep moving on.",https://www.brainyquote.com/quotes/ulysses_s_grant_392698?src=t_moving_on,Ulysses S. Grant,https://www.brainyquote.com/authors/ulysses-s-grant-quotes
Recovery begins from the darkest moment.,https://www.brainyquote.com/quotes/john_major_464664?src=t_moving_on,John Major,https://www.brainyquote.com/authors/john-major-quotes
I can't go on. I'll go on.,https://www.brainyquote.com/quotes/samuel_beckett_131521?src=t_moving_on,Samuel Beckett,https://www.brainyquote.com/authors/samuel-beckett-quotes
Part of the healing process is sharing with other people who care.,https://www.brainyquote.com/quotes/jerry_cantrell_434394?src=t_moving_on,Jerry Cantrell,https://www.brainyquote.com/authors/jerry-cantrell-quotes
"You may have a fresh start any moment you choose, for this thing that we call 'failure' is not the falling down, but the staying down.",https://www.brainyquote.com/quotes/mary_pickford_105053?src=t_moving_on,Mary Pickford,https://www.brainyquote.com/authors/mary-pickford-quotes
We are healed from suffering only by experiencing it to the full.,https://www.brainyquote.com/quotes/marcel_proust_383424?src=t_moving_on,Marcel Proust,https://www.brainyquote.com/authors/marcel-proust-quotes
"The moving finger writes, and having written moves on. Nor all thy piety nor all thy wit, can cancel half a line of it.",https://www.brainyquote.com/quotes/omar_khayyam_390147?src=t_moving_on,Omar Khayyam,https://www.brainyquote.com/authors/omar-khayyam-quotes
"Forgiving does not erase the bitter past. A healed memory is not a deleted memory. Instead, forgiving what we cannot forget creates a new way to remember. We change the memory of our past into a hope for our future.",https://www.brainyquote.com/quotes/lewis_b_smedes_132879?src=t_moving_on,Lewis B. Smedes,https://www.brainyquote.com/authors/lewis-b-smedes-quotes
Forget the past - the future will give you plenty to worry about.,https://www.brainyquote.com/quotes/george_allen_sr_383339?src=t_moving_on,"George Allen, Sr.",https://www.brainyquote.com/authors/george-allen-sr-quotes
Forget the past.,https://www.brainyquote.com/quotes/nelson_mandela_447244?src=t_moving_on,Nelson Mandela,https://www.brainyquote.com/authors/nelson-mandela-quotes
The greatest healing therapy is friendship and love.,https://www.brainyquote.com/quotes/hubert_h_humphrey_152600?src=t_moving_on,Hubert H. Humphrey,https://www.brainyquote.com/authors/hubert-h-humphrey-quotes
Healing yourself is connected with healing others.,https://www.brainyquote.com/quotes/yoko_ono_344186?src=t_moving_on,Yoko Ono,https://www.brainyquote.com/authors/yoko-ono-quotes
Grief is in two parts. The first is loss. The second is the remaking of life.,https://www.brainyquote.com/quotes/anne_roiphe_575179?src=t_moving_on,Anne Roiphe,https://www.brainyquote.com/authors/anne-roiphe-quotes
A man never knows how to say goodbye; a woman never knows when to say it.,https://www.brainyquote.com/quotes/helen_rowland_108311?src=t_moving_on,Helen Rowland,https://www.brainyquote.com/authors/helen-rowland-quotes
"Healing takes courage, and we all have courage, even if we have to dig a little to find it.",https://www.brainyquote.com/quotes/tori_amos_183441?src=t_moving_on,Tori Amos,https://www.brainyquote.com/authors/tori-amos-quotes
"Never despair, but if you do, work on in despair.",https://www.brainyquote.com/quotes/edmund_burke_132426?src=t_moving_on,Edmund Burke,https://www.brainyquote.com/authors/edmund-burke-quotes
I think it's important to have closure in any relationship that ends - from a romantic relationship to a friendship. You should always have a sense of clarity at the end and know why it began and why it ended. You need that in your life to move cleanly into your next phase.,https://www.brainyquote.com/quotes/jennifer_aniston_470486?src=t_moving_on,Jennifer Aniston,https://www.brainyquote.com/authors/jennifer-aniston-quotes
"Because I remember, I despair. Because I remember, I have the duty to reject despair.",https://www.brainyquote.com/quotes/elie_wiesel_112796?src=t_moving_on,Elie Wiesel,https://www.brainyquote.com/authors/elie-wiesel-quotes
Recovery is something that you have to work on every single day and it's something that it doesn't get a day off.,https://www.brainyquote.com/quotes/demi_lovato_433150?src=t_moving_on,Demi Lovato,https://www.brainyquote.com/authors/demi-lovato-quotes
Friendship is certainly the finest balm for the pangs of disappointed love.,https://www.brainyquote.com/quotes/jane_austen_384510?src=t_moving_on,Jane Austen,https://www.brainyquote.com/authors/jane-austen-quotes
I think a spiritual journey is not so much a journey of discovery. It's a journey of recovery. It's a journey of uncovering your own inner nature. It's already there.,https://www.brainyquote.com/quotes/billy_corgan_472252?src=t_moving_on,Billy Corgan,https://www.brainyquote.com/authors/billy-corgan-quotes
"Everywhere across whatever sorrows of which our life is woven, some radiant joy will gaily flash past.",https://www.brainyquote.com/quotes/nikolai_gogol_205581?src=t_moving_on,Nikolai Gogol,https://www.brainyquote.com/authors/nikolai-gogol-quotes
Don't brood. Get on with living and loving. You don't have forever.,https://www.brainyquote.com/quotes/leo_buscaglia_143453?src=t_moving_on,Leo Buscaglia,https://www.brainyquote.com/authors/leo-buscaglia-quotes
"We all have life storms, and when we get the rough times and we recover from them, we should celebrate that we got through it. No matter how bad it may seem, there's always something beautiful that you can find.",https://www.brainyquote.com/quotes/mattie_stepanek_543005?src=t_moving_on,Mattie Stepanek,https://www.brainyquote.com/authors/mattie-stepanek-quotes
"The heart will break, but broken live on.",https://www.brainyquote.com/quotes/lord_byron_380301?src=t_moving_on,Lord Byron,https://www.brainyquote.com/authors/lord-byron-quotes
"Suffering isn't ennobling, recovery is.",https://www.brainyquote.com/quotes/christiaan_barnard_175227?src=t_moving_on,Christiaan Barnard,https://www.brainyquote.com/authors/christiaan-barnard-quotes
Transformation in the world happens when people are healed and start investing in other people.,https://www.brainyquote.com/quotes/michael_w_smith_255468?src=t_moving_on,Michael W. Smith,https://www.brainyquote.com/authors/michael-w-smith-quotes
"I think faith is incredibly important because you will become overwhelmed with what's happening and you will have waves of grief, but when you turn to your faith, I believe God will give you waves of grace to get through it.",https://www.brainyquote.com/quotes/joel_osteen_579119?src=t_moving_on,Joel Osteen,https://www.brainyquote.com/authors/joel-osteen-quotes
"Tears shed for self are tears of weakness, but tears shed for others are a sign of strength.",https://www.brainyquote.com/quotes/billy_graham_150665?src=t_moving_on,Billy Graham,https://www.brainyquote.com/authors/billy-graham-quotes
It is the false shame of fools to try to conceal wounds that have not healed.,https://www.brainyquote.com/quotes/horace_132981?src=t_moving_on,Horace,https://www.brainyquote.com/authors/horace-quotes
"Take those chances and you can achieve greatness, whereas if you go conservative, you'll never know. I truly believe what doesn't kill you makes you stronger. Even if you fail, learning and moving on is sometimes the best thing.",https://www.brainyquote.com/quotes/danica_patrick_429503?src=t_moving_on,Danica Patrick,https://www.brainyquote.com/authors/danica-patrick-quotes
"The willow which bends to the tempest, often escapes better than the oak which resists it; and so in great calamities, it sometimes happens that light and frivolous spirits recover their elasticity and presence of mind sooner than those of a loftier character.",https://www.brainyquote.com/quotes/albert_schweitzer_118981?src=t_moving_on,Albert Schweitzer,https://www.brainyquote.com/authors/albert-schweitzer-quotes
"My life is about ups and downs, great joys and great losses.",https://www.brainyquote.com/quotes/isabel_allende_466137?src=t_moving_on,Isabel Allende,https://www.brainyquote.com/authors/isabel-allende-quotes
"By forgetting the past and by throwing myself into other interests, I forget to worry.",https://www.brainyquote.com/quotes/jack_dempsey_389596?src=t_moving_on,Jack Dempsey,https://www.brainyquote.com/authors/jack-dempsey-quotes
Love is like the measles; we all have to go through it.,https://www.brainyquote.com/quotes/jerome_k_jerome_137072?src=t_moving_on,Jerome K. Jerome,https://www.brainyquote.com/authors/jerome-k-jerome-quotes
"I've been heartbroken. I've broken hearts. That's part of life, and its part of figuring out who you are so you can find the right partner.",https://www.brainyquote.com/quotes/heidi_klum_465812?src=t_moving_on,Heidi Klum,https://www.brainyquote.com/authors/heidi-klum-quotes
The words of kindness are more healing to a drooping heart than balm or honey.,https://www.brainyquote.com/quotes/sarah_fielding_392554?src=t_moving_on,Sarah Fielding,https://www.brainyquote.com/authors/sarah-fielding-quotes
One makes mistakes; that is life. But it is never a mistake to have loved.,https://www.brainyquote.com/quotes/romain_rolland_391941?src=t_moving_on,Romain Rolland,https://www.brainyquote.com/authors/romain-rolland-quotes
"Patience is key for getting over a breakup. That, and trailing off your interaction after the breakup.",https://www.brainyquote.com/quotes/drake_551788?src=t_moving_on,Drake,https://www.brainyquote.com/authors/drake-quotes
There's always something to suggest that you'll never be who you wanted to be. Your choice is to take it or keep on moving.,https://www.brainyquote.com/quotes/phylicia_rashad_205256?src=t_moving_on,Phylicia Rashad,https://www.brainyquote.com/authors/phylicia-rashad-quotes
"O! many a shaft, at random sent, Finds mark the archer little meant! And many a word, at random spoken, May soothe or wound a heart that's broken!",https://www.brainyquote.com/quotes/walter_scott_118817?src=t_moving_on,Walter Scott,https://www.brainyquote.com/authors/walter-scott-quotes
I think you have to know how you feel when you're sad and it's healthy to mourn if a relationship ends.,https://www.brainyquote.com/quotes/leighton_meester_424135?src=t_moving_on,Leighton Meester,https://www.brainyquote.com/authors/leighton-meester-quotes
Falling out of love is chiefly a matter of forgetting how charming someone is.,https://www.brainyquote.com/quotes/iris_murdoch_384745?src=t_moving_on,Iris Murdoch,https://www.brainyquote.com/authors/iris-murdoch-quotes
