quote,quote_url,author,author_url
"The woods are lovely, dark and deep. But I have promises to keep, and miles to go before I sleep.",https://www.brainyquote.com/quotes/robert_frost_151819?src=t_nature,Robert Frost,https://www.brainyquote.com/authors/robert-frost-quotes
"Look deep into nature, and then you will understand everything better.",https://www.brainyquote.com/quotes/albert_einstein_106912?src=t_nature,Albert Einstein,https://www.brainyquote.com/authors/albert-einstein-quotes
"Wherever you go, no matter what the weather, always bring your own sunshine.",https://www.brainyquote.com/quotes/anthony_j_dangelo_104159?src=t_nature,Anthony J. D'Angelo,https://www.brainyquote.com/authors/anthony-j-dangelo-quotes
Forget not that the earth delights to feel your bare feet and the winds long to play with your hair.,https://www.brainyquote.com/quotes/khalil_gibran_106889?src=t_nature,Khalil Gibran,https://www.brainyquote.com/authors/khalil-gibran-quotes
"Nature does not hurry, yet everything is accomplished.",https://www.brainyquote.com/quotes/lao_tzu_151993?src=t_nature,Lao Tzu,https://www.brainyquote.com/authors/lao-tzu-quotes
"Just living is not enough... one must have sunshine, freedom, and a little flower.",https://www.brainyquote.com/quotes/hans_christian_andersen_103515?src=t_nature,Hans Christian Andersen,https://www.brainyquote.com/authors/hans-christian-andersen-quotes
"There is pleasure in the pathless woods, there is rapture in the lonely shore, there is society where none intrudes, by the deep sea, and music in its roar; I love not Man the less, but Nature more.",https://www.brainyquote.com/quotes/lord_byron_201617?src=t_nature,Lord Byron,https://www.brainyquote.com/authors/lord-byron-quotes
In the depth of winter I finally learned that there was in me an invincible summer.,https://www.brainyquote.com/quotes/albert_camus_104177?src=t_nature,Albert Camus,https://www.brainyquote.com/authors/albert-camus-quotes
There is nothing in a caterpillar that tells you it's going to be a butterfly.,https://www.brainyquote.com/quotes/r_buckminster_fuller_100112?src=t_nature,R. Buckminster Fuller,https://www.brainyquote.com/authors/r-buckminster-fuller-quotes
"For my part I know nothing with any certainty, but the sight of the stars makes me dream.",https://www.brainyquote.com/quotes/vincent_van_gogh_385867?src=t_nature,Vincent Van Gogh,https://www.brainyquote.com/authors/vincent-van-gogh-quotes
"Over every mountain there is a path, although it may not be seen from the valley.",https://www.brainyquote.com/quotes/theodore_roethke_120661?src=t_nature,Theodore Roethke,https://www.brainyquote.com/authors/theodore-roethke-quotes
"Nature is so powerful, so strong. Capturing its essence is not easy - your work becomes a dance with light and the weather. It takes you to a place within yourself.",https://www.brainyquote.com/quotes/annie_leibovitz_344657?src=t_nature,Annie Leibovitz,https://www.brainyquote.com/authors/annie-leibovitz-quotes
"Sunshine is delicious, rain is refreshing, wind braces us up, snow is exhilarating; there is really no such thing as bad weather, only different kinds of good weather.",https://www.brainyquote.com/quotes/john_ruskin_108460?src=t_nature,John Ruskin,https://www.brainyquote.com/authors/john-ruskin-quotes
Gray skies are just clouds passing over.,https://www.brainyquote.com/quotes/duke_ellington_167445?src=t_nature,Duke Ellington,https://www.brainyquote.com/authors/duke-ellington-quotes
Light in Nature creates the movement of colors.,https://www.brainyquote.com/quotes/robert_delaunay_307976?src=t_nature,Robert Delaunay,https://www.brainyquote.com/authors/robert-delaunay-quotes
There are always flowers for those who want to see them.,https://www.brainyquote.com/quotes/henri_matisse_109310?src=t_nature,Henri Matisse,https://www.brainyquote.com/authors/henri-matisse-quotes
In all things of nature there is something of the marvelous.,https://www.brainyquote.com/quotes/aristotle_163785?src=t_nature,Aristotle,https://www.brainyquote.com/authors/aristotle-quotes
"Some people walk in the rain, others just get wet.",https://www.brainyquote.com/quotes/roger_miller_107155?src=t_nature,Roger Miller,https://www.brainyquote.com/authors/roger-miller-quotes
"He is richest who is content with the least, for content is the wealth of nature.",https://www.brainyquote.com/quotes/socrates_163092?src=t_nature,Socrates,https://www.brainyquote.com/authors/socrates-quotes
The least movement is of importance to all nature. The entire ocean is affected by a pebble.,https://www.brainyquote.com/quotes/blaise_pascal_159856?src=t_nature,Blaise Pascal,https://www.brainyquote.com/authors/blaise-pascal-quotes
"The sea, once it casts its spell, holds one in its net of wonder forever.",https://www.brainyquote.com/quotes/jacques_yves_cousteau_204406?src=t_nature,Jacques Yves Cousteau,https://www.brainyquote.com/authors/jacques-yves-cousteau-quotes
"O, wind, if winter comes, can spring be far behind?",https://www.brainyquote.com/quotes/percy_bysshe_shelley_378917?src=t_nature,Percy Bysshe Shelley,https://www.brainyquote.com/authors/percy-bysshe-shelley-quotes
"Ocean is more ancient than the mountains, and freighted with the memories and the dreams of Time.",https://www.brainyquote.com/quotes/h_p_lovecraft_278136?src=t_nature,H. P. Lovecraft,https://www.brainyquote.com/authors/h-p-lovecraft-quotes
The best thing one can do when it's raining is to let it rain.,https://www.brainyquote.com/quotes/henry_wadsworth_longfello_108465?src=t_nature,Henry Wadsworth Longfellow,https://www.brainyquote.com/authors/henry-wadsworth-longfello-quotes
"Green is the prime color of the world, and that from which its loveliness arises.",https://www.brainyquote.com/quotes/pedro_calderon_de_la_barc_176296?src=t_nature,Pedro Calderon de la Barca,https://www.brainyquote.com/authors/pedro-calderon-de-la-barc-quotes
The earth has received the embrace of the sun and we shall see the results of that love.,https://www.brainyquote.com/quotes/sitting_bull_260475?src=t_nature,Sitting Bull,https://www.brainyquote.com/authors/sitting-bull-quotes
The poetry of the earth is never dead.,https://www.brainyquote.com/quotes/john_keats_106894?src=t_nature,John Keats,https://www.brainyquote.com/authors/john-keats-quotes
"I decided that if I could paint that flower in a huge scale, you could not ignore its beauty.",https://www.brainyquote.com/quotes/georgia_okeeffe_116595?src=t_nature,Georgia O'Keeffe,https://www.brainyquote.com/authors/georgia-okeeffe-quotes
"The day, water, sun, moon, night - I do not have to purchase these things with money.",https://www.brainyquote.com/quotes/plautus_139067?src=t_nature,Plautus,https://www.brainyquote.com/authors/plautus-quotes
Let the rain kiss you. Let the rain beat upon your head with silver liquid drops. Let the rain sing you a lullaby.,https://www.brainyquote.com/quotes/langston_hughes_108462?src=t_nature,Langston Hughes,https://www.brainyquote.com/authors/langston-hughes-quotes
"For in the true nature of things, if we rightly consider, every green tree is far more glorious than if it were made of gold and silver.",https://www.brainyquote.com/quotes/martin_luther_161910?src=t_nature,Martin Luther,https://www.brainyquote.com/authors/martin-luther-quotes
What the caterpillar calls the end of the world the master calls a butterfly.,https://www.brainyquote.com/quotes/richard_bach_132675?src=t_nature,Richard Bach,https://www.brainyquote.com/authors/richard-bach-quotes
"Nature holds the key to our aesthetic, intellectual, cognitive and even spiritual satisfaction.",https://www.brainyquote.com/quotes/e_o_wilson_133730?src=t_nature,E. O. Wilson,https://www.brainyquote.com/authors/e-o-wilson-quotes
"Simplicity is natures first step, and the last of art.",https://www.brainyquote.com/quotes/philip_james_bailey_158784?src=t_nature,Philip James Bailey,https://www.brainyquote.com/authors/philip-james-bailey-quotes
"It is not light that we need, but fire; it is not the gentle shower, but thunder. We need the storm, the whirlwind, and the earthquake.",https://www.brainyquote.com/quotes/frederick_douglass_134570?src=t_nature,Frederick Douglass,https://www.brainyquote.com/authors/frederick-douglass-quotes
Sunlight is painting.,https://www.brainyquote.com/quotes/nathaniel_hawthorne_153032?src=t_nature,Nathaniel Hawthorne,https://www.brainyquote.com/authors/nathaniel-hawthorne-quotes
When you go in search of honey you must expect to be stung by bees.,https://www.brainyquote.com/quotes/joseph_joubert_119974?src=t_nature,Joseph Joubert,https://www.brainyquote.com/authors/joseph-joubert-quotes
"I love to think of nature as an unlimited broadcasting station, through which God speaks to us every hour, if we will only tune in.",https://www.brainyquote.com/quotes/george_washington_carver_106884?src=t_nature,George Washington Carver,https://www.brainyquote.com/authors/george-washington-carver-quotes
"On earth there is no heaven, but there are pieces of it.",https://www.brainyquote.com/quotes/jules_renard_165095?src=t_nature,Jules Renard,https://www.brainyquote.com/authors/jules-renard-quotes
"The butterfly counts not months but moments, and has time enough.",https://www.brainyquote.com/quotes/rabindranath_tagore_108231?src=t_nature,Rabindranath Tagore,https://www.brainyquote.com/authors/rabindranath-tagore-quotes
"Even with all our technology and the inventions that make modern life so much easier than it once was, it takes just one big natural disaster to wipe all that away and remind us that, here on Earth, we're still at the mercy of nature.",https://www.brainyquote.com/quotes/neil_degrasse_tyson_531162?src=t_nature,Neil deGrasse Tyson,https://www.brainyquote.com/authors/neil-degrasse-tyson-quotes
One touch of nature makes the whole world kin.,https://www.brainyquote.com/quotes/william_shakespeare_106907?src=t_nature,William Shakespeare,https://www.brainyquote.com/authors/william-shakespeare-quotes
"Adapt or perish, now as ever, is nature's inexorable imperative.",https://www.brainyquote.com/quotes/h_g_wells_121062?src=t_nature,H. G. Wells,https://www.brainyquote.com/authors/h-g-wells-quotes
Nature never deceives us; it is we who deceive ourselves.,https://www.brainyquote.com/quotes/jeanjacques_rousseau_147581?src=t_nature,Jean-Jacques Rousseau,https://www.brainyquote.com/authors/jean-jacques-rousseau-quotes
"My boy, one small breeze doesn't make a wind storm.",https://www.brainyquote.com/quotes/john_mcgraw_139492?src=t_nature,John McGraw,https://www.brainyquote.com/authors/john-mcgraw-quotes
Nature is the art of God.,https://www.brainyquote.com/quotes/dante_alighieri_379809?src=t_nature,Dante Alighieri,https://www.brainyquote.com/authors/dante-alighieri-quotes
"We do not see nature with our eyes, but with our understandings and our hearts.",https://www.brainyquote.com/quotes/william_hazlitt_151984?src=t_nature,William Hazlitt,https://www.brainyquote.com/authors/william-hazlitt-quotes
Nature is a petrified magic city.,https://www.brainyquote.com/quotes/novalis_380442?src=t_nature,Novalis,https://www.brainyquote.com/authors/novalis-quotes
Never measure the height of a mountain until you have reached the top. Then you will see how low it was.,https://www.brainyquote.com/quotes/dag_hammarskjold_100818?src=t_nature,Dag Hammarskjold,https://www.brainyquote.com/authors/dag-hammarskjold-quotes
"I go to nature to be soothed and healed, and to have my senses put in order.",https://www.brainyquote.com/quotes/john_burroughs_106918?src=t_nature,John Burroughs,https://www.brainyquote.com/authors/john-burroughs-quotes
"May your trails be crooked, winding, lonesome, dangerous, leading to the most amazing view. May your mountains rise into and above the clouds.",https://www.brainyquote.com/quotes/edward_abbey_151950?src=t_nature,Edward Abbey,https://www.brainyquote.com/authors/edward-abbey-quotes
To sit in the shade on a fine day and look upon verdure is the most perfect refreshment.,https://www.brainyquote.com/quotes/jane_austen_106902?src=t_nature,Jane Austen,https://www.brainyquote.com/authors/jane-austen-quotes
"Rain is grace; rain is the sky descending to the earth; without rain, there would be no life.",https://www.brainyquote.com/quotes/john_updike_139330?src=t_nature,John Updike,https://www.brainyquote.com/authors/john-updike-quotes
Pick a flower on Earth and you move the farthest star.,https://www.brainyquote.com/quotes/paul_dirac_388049?src=t_nature,Paul Dirac,https://www.brainyquote.com/authors/paul-dirac-quotes
"The sun, with all those planets revolving around it and dependent on it, can still ripen a bunch of grapes as if it had nothing else in the universe to do.",https://www.brainyquote.com/quotes/galileo_galilei_106899?src=t_nature,Galileo Galilei,https://www.brainyquote.com/authors/galileo-galilei-quotes
"Like music and art, love of nature is a common language that can transcend political or social boundaries.",https://www.brainyquote.com/quotes/jimmy_carter_124625?src=t_nature,Jimmy Carter,https://www.brainyquote.com/authors/jimmy-carter-quotes
Birds sing after a storm; why shouldn't people feel as free to delight in whatever sunlight remains to them?,https://www.brainyquote.com/quotes/rose_kennedy_103801?src=t_nature,Rose Kennedy,https://www.brainyquote.com/authors/rose-kennedy-quotes
"Earth and sky, woods and fields, lakes and rivers, the mountain and the sea, are excellent schoolmasters, and teach some of us more than we can ever learn from books.",https://www.brainyquote.com/quotes/john_lubbock_122570?src=t_nature,John Lubbock,https://www.brainyquote.com/authors/john-lubbock-quotes
Land really is the best art.,https://www.brainyquote.com/quotes/andy_warhol_109669?src=t_nature,Andy Warhol,https://www.brainyquote.com/authors/andy-warhol-quotes
"If you wish to make an apple pie from scratch, you must first invent the universe.",https://www.brainyquote.com/quotes/carl_sagan_137409?src=t_nature,Carl Sagan,https://www.brainyquote.com/authors/carl-sagan-quotes
