quote,quote_url,author,author_url
Patience is not simply the ability to wait - it's how we behave while we're waiting.,https://www.brainyquote.com/quotes/joyce_meyer_567645?src=t_patience,Joyce Meyer,https://www.brainyquote.com/authors/joyce-meyer-quotes
Beware the fury of a patient man.,https://www.brainyquote.com/quotes/john_dryden_101689?src=t_patience,John Dryden,https://www.brainyquote.com/authors/john-dryden-quotes
"Patience is bitter, but its fruit is sweet.",https://www.brainyquote.com/quotes/jeanjacques_rousseau_122782?src=t_patience,Jean-Jacques Rousseau,https://www.brainyquote.com/authors/jean-jacques-rousseau-quotes
"It is easier to find men who will volunteer to die, than to find those who are willing to endure pain with patience.",https://www.brainyquote.com/quotes/julius_caesar_135052?src=t_patience,Julius Caesar,https://www.brainyquote.com/authors/julius-caesar-quotes
Patience and perseverance have a magical effect before which difficulties disappear and obstacles vanish.,https://www.brainyquote.com/quotes/john_quincy_adams_387094?src=t_patience,John Quincy Adams,https://www.brainyquote.com/authors/john-quincy-adams-quotes
Great works are performed not by strength but by perseverance.,https://www.brainyquote.com/quotes/samuel_johnson_121919?src=t_patience,Samuel Johnson,https://www.brainyquote.com/authors/samuel-johnson-quotes
"Patience is a virtue, and I'm learning patience. It's a tough lesson.",https://www.brainyquote.com/quotes/elon_musk_567252?src=t_patience,Elon Musk,https://www.brainyquote.com/authors/elon-musk-quotes
"Even a happy life cannot be without a measure of darkness, and the word happy would lose its meaning if it were not balanced by sadness. It is far better take things as they come along with patience and equanimity.",https://www.brainyquote.com/quotes/carl_jung_157285?src=t_patience,Carl Jung,https://www.brainyquote.com/authors/carl-jung-quotes
A man who is a master of patience is master of everything else.,https://www.brainyquote.com/quotes/george_savile_381357?src=t_patience,George Savile,https://www.brainyquote.com/authors/george-savile-quotes
Have patience. All things are difficult before they become easy.,https://www.brainyquote.com/quotes/saadi_155337?src=t_patience,Saadi,https://www.brainyquote.com/authors/saadi-quotes
"Patience, persistence and perspiration make an unbeatable combination for success.",https://www.brainyquote.com/quotes/napoleon_hill_152875?src=t_patience,Napoleon Hill,https://www.brainyquote.com/authors/napoleon-hill-quotes
"Have patience with all things, But, first of all with yourself.",https://www.brainyquote.com/quotes/saint_francis_de_sales_193306?src=t_patience,Saint Francis de Sales,https://www.brainyquote.com/authors/saint-francis-de-sales-quotes
I am patient with stupidity but not with those who are proud of it.,https://www.brainyquote.com/quotes/edith_sitwell_121388?src=t_patience,Edith Sitwell,https://www.brainyquote.com/authors/edith-sitwell-quotes
Never cut a tree down in the wintertime. Never make a negative decision in the low time. Never make your most important decisions when you are in your worst moods. Wait. Be patient. The storm will pass. The spring will come.,https://www.brainyquote.com/quotes/robert_h_schuller_393754?src=t_patience,Robert H. Schuller,https://www.brainyquote.com/authors/robert-h-schuller-quotes
"Come what may, all bad fortune is to be conquered by endurance.",https://www.brainyquote.com/quotes/virgil_145413?src=t_patience,Virgil,https://www.brainyquote.com/authors/virgil-quotes
"With love and patience, nothing is impossible.",https://www.brainyquote.com/quotes/daisaku_ikeda_185216?src=t_patience,Daisaku Ikeda,https://www.brainyquote.com/authors/daisaku-ikeda-quotes
"We could never learn to be brave and patient, if there were only joy in the world.",https://www.brainyquote.com/quotes/helen_keller_385215?src=t_patience,Helen Keller,https://www.brainyquote.com/authors/helen-keller-quotes
Sometimes things aren't clear right away. That's where you need to be patient and persevere and see where things lead.,https://www.brainyquote.com/quotes/mary_pierce_423404?src=t_patience,Mary Pierce,https://www.brainyquote.com/authors/mary-pierce-quotes
Patience is the best remedy for every trouble.,https://www.brainyquote.com/quotes/plautus_184391?src=t_patience,Plautus,https://www.brainyquote.com/authors/plautus-quotes
"I have seen many storms in my life. Most storms have caught me by surprise, so I had to learn very quickly to look further and understand that I am not capable of controlling the weather, to exercise the art of patience and to respect the fury of nature.",https://www.brainyquote.com/quotes/paulo_coelho_620633?src=t_patience,Paulo Coelho,https://www.brainyquote.com/authors/paulo-coelho-quotes
He that can have patience can have what he will.,https://www.brainyquote.com/quotes/benjamin_franklin_151645?src=t_patience,Benjamin Franklin,https://www.brainyquote.com/authors/benjamin-franklin-quotes
Genius is eternal patience.,https://www.brainyquote.com/quotes/michelangelo_183564?src=t_patience,Michelangelo,https://www.brainyquote.com/authors/michelangelo-quotes
"The key to everything is patience. You get the chicken by hatching the egg, not by smashing it.",https://www.brainyquote.com/quotes/arnold_h_glasow_125821?src=t_patience,Arnold H. Glasow,https://www.brainyquote.com/authors/arnold-h-glasow-quotes
"Good character is not formed in a week or a month. It is created little by little, day by day. Protracted and patient effort is needed to develop good character.",https://www.brainyquote.com/quotes/heraclitus_117864?src=t_patience,Heraclitus,https://www.brainyquote.com/authors/heraclitus-quotes
Our patience will achieve more than our force.,https://www.brainyquote.com/quotes/edmund_burke_101688?src=t_patience,Edmund Burke,https://www.brainyquote.com/authors/edmund-burke-quotes
"Patience has its limits. Take it too far, and it's cowardice.",https://www.brainyquote.com/quotes/george_jackson_176692?src=t_patience,George Jackson,https://www.brainyquote.com/authors/george-jackson-quotes
"Wise to resolve, and patient to perform.",https://www.brainyquote.com/quotes/homer_380092?src=t_patience,Homer,https://www.brainyquote.com/authors/homer-quotes
Only those who have patience to do simple things perfectly ever acquire the skill to do difficult things easily.,https://www.brainyquote.com/quotes/james_j_corbett_229122?src=t_patience,James J. Corbett,https://www.brainyquote.com/authors/james-j-corbett-quotes
There is something good in all seeming failures. You are not to see that now. Time will reveal it. Be patient.,https://www.brainyquote.com/quotes/swami_sivananda_164465?src=t_patience,Swami Sivananda,https://www.brainyquote.com/authors/swami-sivananda-quotes
Be patient and understanding. Life is too short to be vengeful or malicious.,https://www.brainyquote.com/quotes/phillips_brooks_197986?src=t_patience,Phillips Brooks,https://www.brainyquote.com/authors/phillips-brooks-quotes
"Patience and Diligence, like faith, remove mountains.",https://www.brainyquote.com/quotes/william_penn_121888?src=t_patience,William Penn,https://www.brainyquote.com/authors/william-penn-quotes
The test of good manners is to be patient with the bad ones.,https://www.brainyquote.com/quotes/solomon_ibn_gabirol_164759?src=t_patience,Solomon Ibn Gabirol,https://www.brainyquote.com/authors/solomon-ibn-gabirol-quotes
Patience is passion tamed.,https://www.brainyquote.com/quotes/lyman_abbott_316988?src=t_patience,Lyman Abbott,https://www.brainyquote.com/authors/lyman-abbott-quotes
Good ideas are not adopted automatically. They must be driven into practice with courageous impatience.,https://www.brainyquote.com/quotes/hyman_rickover_126384?src=t_patience,Hyman Rickover,https://www.brainyquote.com/authors/hyman-rickover-quotes
"Above all, remember that God looks for solid virtues in us, such as patience, humility, obedience, abnegation of your own will - that is, the good will to serve Him and our neighbor in Him. His providence allows us other devotions only insofar as He sees that they are useful to us.",https://www.brainyquote.com/quotes/saint_ignatius_564142?src=t_patience,Saint Ignatius,https://www.brainyquote.com/authors/saint-ignatius-quotes
How poor are they that have not patience! What wound did ever heal but by degrees?,https://www.brainyquote.com/quotes/william_shakespeare_132976?src=t_patience,William Shakespeare,https://www.brainyquote.com/authors/william-shakespeare-quotes
"Patience has its limits, take it too far and it's cowardice.",https://www.brainyquote.com/quotes/holbrook_jackson_388355?src=t_patience,Holbrook Jackson,https://www.brainyquote.com/authors/holbrook-jackson-quotes
Patience is the art of concealing your impatience.,https://www.brainyquote.com/quotes/guy_kawasaki_378244?src=t_patience,Guy Kawasaki,https://www.brainyquote.com/authors/guy-kawasaki-quotes
Patience is the art of hoping.,https://www.brainyquote.com/quotes/luc_de_clapiers_145367?src=t_patience,Luc de Clapiers,https://www.brainyquote.com/authors/luc-de-clapiers-quotes
Humility is attentive patience.,https://www.brainyquote.com/quotes/simone_weil_125768?src=t_patience,Simone Weil,https://www.brainyquote.com/authors/simone-weil-quotes
"To bear with patience wrongs done to oneself is a mark of perfection, but to bear with patience wrongs done to someone else is a mark of imperfection and even of actual sin.",https://www.brainyquote.com/quotes/thomas_aquinas_192510?src=t_patience,Thomas Aquinas,https://www.brainyquote.com/authors/thomas-aquinas-quotes
Patience is the support of weakness; impatience the ruin of strength.,https://www.brainyquote.com/quotes/charles_caleb_colton_156471?src=t_patience,Charles Caleb Colton,https://www.brainyquote.com/authors/charles-caleb-colton-quotes
"For anything worth having one must pay the price; and the price is always work, patience, love, self-sacrifice - no paper currency, no promises to pay, but the gold of real service.",https://www.brainyquote.com/quotes/john_burroughs_150290?src=t_patience,John Burroughs,https://www.brainyquote.com/authors/john-burroughs-quotes
Abused patience turns to fury.,https://www.brainyquote.com/quotes/thomas_fuller_139094?src=t_patience,Thomas Fuller,https://www.brainyquote.com/authors/thomas-fuller-quotes
"Patience, n. A minor form of dispair, disguised as a virtue.",https://www.brainyquote.com/quotes/ambrose_bierce_101687?src=t_patience,Ambrose Bierce,https://www.brainyquote.com/authors/ambrose-bierce-quotes
He who rides the sea of the Nile must have sails woven of patience.,https://www.brainyquote.com/quotes/william_golding_113546?src=t_patience,William Golding,https://www.brainyquote.com/authors/william-golding-quotes
"I am not a perfect servant. I am a public servant doing my best against the odds. As I develop and serve, be patient. God is not finished with me yet.",https://www.brainyquote.com/quotes/jesse_jackson_114623?src=t_patience,Jesse Jackson,https://www.brainyquote.com/authors/jesse-jackson-quotes
"My dad said to me, 'Work hard and be patient.' It was the best advice he ever gave me. You have to put the hours in.",https://www.brainyquote.com/quotes/simon_cowell_540145?src=t_patience,Simon Cowell,https://www.brainyquote.com/authors/simon-cowell-quotes
"Endurance is the crowning quality, And patience all the passion of great hearts.",https://www.brainyquote.com/quotes/james_russell_lowell_385005?src=t_patience,James Russell Lowell,https://www.brainyquote.com/authors/james-russell-lowell-quotes
"Our real blessings often appear to us in the shape of pains, losses and disappointments; but let us have patience and we soon shall see them in their proper figures.",https://www.brainyquote.com/quotes/joseph_addison_148389?src=t_patience,Joseph Addison,https://www.brainyquote.com/authors/joseph-addison-quotes
"Work hard. And have patience. Because no matter who you are, you're going to get hurt in your career and you have to be patient to get through the injuries.",https://www.brainyquote.com/quotes/randy_johnson_480495?src=t_patience,Randy Johnson,https://www.brainyquote.com/authors/randy-johnson-quotes
"Endurance is nobler than strength, and patience than beauty.",https://www.brainyquote.com/quotes/john_ruskin_118048?src=t_patience,John Ruskin,https://www.brainyquote.com/authors/john-ruskin-quotes
Endurance is patience concentrated.,https://www.brainyquote.com/quotes/thomas_carlyle_380709?src=t_patience,Thomas Carlyle,https://www.brainyquote.com/authors/thomas-carlyle-quotes
There is no road too long to the man who advances deliberately and without undue haste; there are no honors too distant to the man who prepares himself for them with patience.,https://www.brainyquote.com/quotes/jean_de_la_bruyere_121889?src=t_patience,Jean de la Bruyere,https://www.brainyquote.com/authors/jean-de-la-bruyere-quotes
Patience is the ability to idle your motor when you feel like stripping your gears.,https://www.brainyquote.com/quotes/barbara_johnson_173100?src=t_patience,Barbara Johnson,https://www.brainyquote.com/authors/barbara-johnson-quotes
"Patience, that blending of moral courage with physical timidity.",https://www.brainyquote.com/quotes/thomas_hardy_152304?src=t_patience,Thomas Hardy,https://www.brainyquote.com/authors/thomas-hardy-quotes
I'm patient.,https://www.brainyquote.com/quotes/michael_jordan_447173?src=t_patience,Michael Jordan,https://www.brainyquote.com/authors/michael-jordan-quotes
Heaven grant us patience with a man in love.,https://www.brainyquote.com/quotes/rudyard_kipling_152260?src=t_patience,Rudyard Kipling,https://www.brainyquote.com/authors/rudyard-kipling-quotes
Who ever is out of patience is out of possession of their soul.,https://www.brainyquote.com/quotes/francis_bacon_149860?src=t_patience,Francis Bacon,https://www.brainyquote.com/authors/francis-bacon-quotes
Everyone ought to bear patiently the results of his own conduct.,https://www.brainyquote.com/quotes/phaedrus_117866?src=t_patience,Phaedrus,https://www.brainyquote.com/authors/phaedrus-quotes
