quote,quote_url,author,author_url
"Respect for ourselves guides our morals, respect for others guides our manners.",https://www.brainyquote.com/quotes/laurence_sterne_165818?src=t_respect,Laurence Sterne,https://www.brainyquote.com/authors/laurence-sterne-quotes
"We don't need to share the same opinions as others, but we need to be respectful.",https://www.brainyquote.com/quotes/taylor_swift_579514?src=t_respect,Taylor Swift,https://www.brainyquote.com/authors/taylor-swift-quotes
"To the living we owe respect, but to the dead we owe only the truth.",https://www.brainyquote.com/quotes/voltaire_397106?src=t_respect,Voltaire,https://www.brainyquote.com/authors/voltaire-quotes
One of the most sincere forms of respect is actually listening to what another has to say.,https://www.brainyquote.com/quotes/bryant_h_mcgill_168254?src=t_respect,Bryant H. McGill,https://www.brainyquote.com/authors/bryant-h-mcgill-quotes
"Respect your efforts, respect yourself. Self-respect leads to self-discipline. When you have both firmly under your belt, that's real power.",https://www.brainyquote.com/quotes/clint_eastwood_392797?src=t_respect,Clint Eastwood,https://www.brainyquote.com/authors/clint-eastwood-quotes
Self-respect is the fruit of discipline; the sense of dignity grows with the ability to say no to oneself.,https://www.brainyquote.com/quotes/abraham_joshua_heschel_114461?src=t_respect,Abraham Joshua Heschel,https://www.brainyquote.com/authors/abraham-joshua-heschel-quotes
I'm not concerned with your liking or disliking me... All I ask is that you respect me as a human being.,https://www.brainyquote.com/quotes/jackie_robinson_140153?src=t_respect,Jackie Robinson,https://www.brainyquote.com/authors/jackie-robinson-quotes
"When you are content to be simply yourself and don't compare or compete, everybody will respect you.",https://www.brainyquote.com/quotes/lao_tzu_100932?src=t_respect,Lao Tzu,https://www.brainyquote.com/authors/lao-tzu-quotes
"If we are not free, no one will respect us.",https://www.brainyquote.com/quotes/a_p_j_abdul_kalam_179898?src=t_respect,A. P. J. Abdul Kalam,https://www.brainyquote.com/authors/a-p-j-abdul-kalam-quotes
"To free us from the expectations of others, to give us back to ourselves - there lies the great, singular power of self-respect.",https://www.brainyquote.com/quotes/joan_didion_389089?src=t_respect,Joan Didion,https://www.brainyquote.com/authors/joan-didion-quotes
"Everyone should be respected as an individual, but no one idolized.",https://www.brainyquote.com/quotes/albert_einstein_163169?src=t_respect,Albert Einstein,https://www.brainyquote.com/authors/albert-einstein-quotes
I never make the mistake of arguing with people for whose opinions I have no respect.,https://www.brainyquote.com/quotes/edward_gibbon_130926?src=t_respect,Edward Gibbon,https://www.brainyquote.com/authors/edward-gibbon-quotes
Nothing is more despicable than respect based on fear.,https://www.brainyquote.com/quotes/albert_camus_382275?src=t_respect,Albert Camus,https://www.brainyquote.com/authors/albert-camus-quotes
The final test of a gentleman is his respect for those who can be of no possible service to him.,https://www.brainyquote.com/quotes/william_lyon_phelps_159535?src=t_respect,William Lyon Phelps,https://www.brainyquote.com/authors/william-lyon-phelps-quotes
"I firmly believe that respect is a lot more important, and a lot greater, than popularity.",https://www.brainyquote.com/quotes/julius_erving_289208?src=t_respect,Julius Erving,https://www.brainyquote.com/authors/julius-erving-quotes
"Show respect to all people, but grovel to none.",https://www.brainyquote.com/quotes/tecumseh_190015?src=t_respect,Tecumseh,https://www.brainyquote.com/authors/tecumseh-quotes
"Everyone in society should be a role model, not only for their own self-respect, but for respect from others.",https://www.brainyquote.com/quotes/barry_bonds_267215?src=t_respect,Barry Bonds,https://www.brainyquote.com/authors/barry-bonds-quotes
There is no respect for others without humility in one's self.,https://www.brainyquote.com/quotes/henri_frederic_amiel_148230?src=t_respect,Henri Frederic Amiel,https://www.brainyquote.com/authors/henri-frederic-amiel-quotes
"A person's a person, no matter how small.",https://www.brainyquote.com/quotes/dr_seuss_102344?src=t_respect,Dr. Seuss,https://www.brainyquote.com/authors/dr-seuss-quotes
And the greatest lesson that mom ever taught me though was this one. She told me there would be times in your life when you have to choose between being loved and being respected. Now she said to always pick being respected.,https://www.brainyquote.com/quotes/chris_christie_447774?src=t_respect,Chris Christie,https://www.brainyquote.com/authors/chris-christie-quotes
"This world of ours... must avoid becoming a community of dreadful fear and hate, and be, instead, a proud confederation of mutual trust and respect.",https://www.brainyquote.com/quotes/dwight_d_eisenhower_169267?src=t_respect,Dwight D. Eisenhower,https://www.brainyquote.com/authors/dwight-d-eisenhower-quotes
"We should all consider each other as human beings, and we should respect each other.",https://www.brainyquote.com/quotes/malala_yousafzai_662499?src=t_respect,Malala Yousafzai,https://www.brainyquote.com/authors/malala-yousafzai-quotes
"To be one, to be united is a great thing. But to respect the right to be different is maybe even greater.",https://www.brainyquote.com/quotes/bono_129880?src=t_respect,Bono,https://www.brainyquote.com/authors/bono-quotes
"As all human beings are, in my view, creatures of God's design, we must respect all other human beings. That does not mean I have to agree with their choices or agree with their opinions, but indeed I respect them as human beings.",https://www.brainyquote.com/quotes/stockwell_day_203858?src=t_respect,Stockwell Day,https://www.brainyquote.com/authors/stockwell-day-quotes
I have always believed that I should have had no difficulty in causing my rights to be respected.,https://www.brainyquote.com/quotes/eli_whitney_298011?src=t_respect,Eli Whitney,https://www.brainyquote.com/authors/eli-whitney-quotes
Being brilliant is no great feat if you respect nothing.,https://www.brainyquote.com/quotes/johann_wolfgang_von_goeth_133621?src=t_respect,Johann Wolfgang von Goethe,https://www.brainyquote.com/authors/johann-wolfgang-von-goeth-quotes
"Be modest, be respectful of others, try to understand.",https://www.brainyquote.com/quotes/lakhdar_brahimi_287671?src=t_respect,Lakhdar Brahimi,https://www.brainyquote.com/authors/lakhdar-brahimi-quotes
When people do not respect us we are sharply offended; yet in his private heart no man much respects himself.,https://www.brainyquote.com/quotes/mark_twain_387396?src=t_respect,Mark Twain,https://www.brainyquote.com/authors/mark-twain-quotes
Respect yourself if you would have others respect you.,https://www.brainyquote.com/quotes/baltasar_gracian_150648?src=t_respect,Baltasar Gracian,https://www.brainyquote.com/authors/baltasar-gracian-quotes
"Respect is what we owe; love, what we give.",https://www.brainyquote.com/quotes/philip_james_bailey_378905?src=t_respect,Philip James Bailey,https://www.brainyquote.com/authors/philip-james-bailey-quotes
"There exist only three beings worthy of respect: the priest, the soldier, the poet. To know, to kill, to create.",https://www.brainyquote.com/quotes/charles_baudelaire_297545?src=t_respect,Charles Baudelaire,https://www.brainyquote.com/authors/charles-baudelaire-quotes
It is so important to get respect for what you do and at the same time give it.,https://www.brainyquote.com/quotes/estelle_parsons_261403?src=t_respect,Estelle Parsons,https://www.brainyquote.com/authors/estelle-parsons-quotes
It's not that the Irish are cynical. It's rather that they have a wonderful lack of respect for everything and everybody.,https://www.brainyquote.com/quotes/brendan_behan_391281?src=t_respect,Brendan Behan,https://www.brainyquote.com/authors/brendan-behan-quotes
"If once you forfeit the confidence of your fellow-citizens, you can never regain their respect and esteem.",https://www.brainyquote.com/quotes/abraham_lincoln_151233?src=t_respect,Abraham Lincoln,https://www.brainyquote.com/authors/abraham-lincoln-quotes
"Our moral, religious, and political traditions are united in their respect for the dignity of human life.",https://www.brainyquote.com/quotes/robert_casey_288868?src=t_respect,Robert Casey,https://www.brainyquote.com/authors/robert-casey-quotes
"I have no right, by anything I do or say, to demean a human being in his own eyes. What matters is not what I think of him; it is what he thinks of himself. To undermine a man's self-respect is a sin.",https://www.brainyquote.com/quotes/antoine_de_saintexupery_137412?src=t_respect,Antoine de Saint-Exupery,https://www.brainyquote.com/authors/antoine-de-saint-exupery-quotes
"That you may retain your self-respect, it is better to displease the people by doing what you know is right, than to temporarily please them by doing what you know is wrong.",https://www.brainyquote.com/quotes/william_j_h_boetcker_107741?src=t_respect,William J. H. Boetcker,https://www.brainyquote.com/authors/william-j-h-boetcker-quotes
"Go up close to your friend, but do not go over to him! We should also respect the enemy in our friend.",https://www.brainyquote.com/quotes/friedrich_nietzsche_392142?src=t_respect,Friedrich Nietzsche,https://www.brainyquote.com/authors/friedrich-nietzsche-quotes
"I owe my success to having listened respectfully to the very best advice, and then going away and doing the exact opposite.",https://www.brainyquote.com/quotes/gilbert_k_chesterton_124997?src=t_respect,Gilbert K. Chesterton,https://www.brainyquote.com/authors/gilbert-k-chesterton-quotes
"I'm not everybody's cup of tea. But sometimes criticism can be hurtful. Be respectful. I'm a good piano player, I can sing well, I write good songs. If you don't like it, fair enough. But give me a break.",https://www.brainyquote.com/quotes/elton_john_578367?src=t_respect,Elton John,https://www.brainyquote.com/authors/elton-john-quotes
I think I'm a natural-born leader. I know how to bow down to authority if it's authority that I respect.,https://www.brainyquote.com/quotes/tupac_shakur_315833?src=t_respect,Tupac Shakur,https://www.brainyquote.com/authors/tupac-shakur-quotes
I'm sick of just liking people. I wish to God I could meet somebody I could respect.,https://www.brainyquote.com/quotes/j_d_salinger_385432?src=t_respect,J. D. Salinger,https://www.brainyquote.com/authors/j-d-salinger-quotes
Perhaps the surest test of an individual's integrity is his refusal to do or say anything that would damage his self-respect.,https://www.brainyquote.com/quotes/thomas_s_monson_188464?src=t_respect,Thomas S. Monson,https://www.brainyquote.com/authors/thomas-s-monson-quotes
"The person who comes up to you and makes the most noise and is the most intrusive is invariably the person in the room who has no respect for you at all, and it's really all about them.",https://www.brainyquote.com/quotes/robbie_coltrane_214644?src=t_respect,Robbie Coltrane,https://www.brainyquote.com/authors/robbie-coltrane-quotes
"I think a lot of people have lost respect for the individual, you know, the individual, the person who doesn't conform.",https://www.brainyquote.com/quotes/erykah_badu_309480?src=t_respect,Erykah Badu,https://www.brainyquote.com/authors/erykah-badu-quotes
"I have nothing against respecting people who lived before, but we have no responsibility toward them.",https://www.brainyquote.com/quotes/leon_kass_282397?src=t_respect,Leon Kass,https://www.brainyquote.com/authors/leon-kass-quotes
"As the mother of two daughters, I have great respect for women. And I don't ever want to lose that.",https://www.brainyquote.com/quotes/vera_wang_272281?src=t_respect,Vera Wang,https://www.brainyquote.com/authors/vera-wang-quotes
Never dress down for the poor. They won't respect you for it. They want their First Lady to look like a million dollars.,https://www.brainyquote.com/quotes/imelda_marcos_126983?src=t_respect,Imelda Marcos,https://www.brainyquote.com/authors/imelda-marcos-quotes
"In order to acquire a growing and lasting respect in society, it is a good thing, if you possess great talent, to give, early in your youth, a very hard kick to the right shin of the society that you love. After that, be a snob.",https://www.brainyquote.com/quotes/salvador_dali_154009?src=t_respect,Salvador Dali,https://www.brainyquote.com/authors/salvador-dali-quotes
"Americans have been conditioned to respect newness, whatever it costs them.",https://www.brainyquote.com/quotes/john_updike_100261?src=t_respect,John Updike,https://www.brainyquote.com/authors/john-updike-quotes
"Assuredly, Loving Souls, you should go to God with all humility and respect, humbling yourselves in His presence, especially when you remember your past ingratitude and sins.",https://www.brainyquote.com/quotes/alphonsus_liguori_358205?src=t_respect,Alphonsus Liguori,https://www.brainyquote.com/authors/alphonsus-liguori-quotes
"But really, we also need to learn how to love one another as women. How to appreciate and respect each other.",https://www.brainyquote.com/quotes/chaka_khan_261107?src=t_respect,Chaka Khan,https://www.brainyquote.com/authors/chaka-khan-quotes
"I have a respect for manners as such, they are a way of dealing with people you don't agree with or like.",https://www.brainyquote.com/quotes/margaret_mead_387121?src=t_respect,Margaret Mead,https://www.brainyquote.com/authors/margaret-mead-quotes
Men are so willing to respect anything that bores them.,https://www.brainyquote.com/quotes/marilyn_monroe_382334?src=t_respect,Marilyn Monroe,https://www.brainyquote.com/authors/marilyn-monroe-quotes
People want to hear what I have to say and respect what I say.,https://www.brainyquote.com/quotes/jennifer_capriati_262032?src=t_respect,Jennifer Capriati,https://www.brainyquote.com/authors/jennifer-capriati-quotes
America wants its respect.,https://www.brainyquote.com/quotes/tupac_shakur_315803?src=t_respect,Tupac Shakur,https://www.brainyquote.com/authors/tupac-shakur-quotes
Let every man be respected as an individual and no man idolized.,https://www.brainyquote.com/quotes/albert_einstein_163899?src=t_respect,Albert Einstein,https://www.brainyquote.com/authors/albert-einstein-quotes
"Be peaceful, be courteous, obey the law, respect everyone; but if someone puts his hand on you, send him to the cemetery.",https://www.brainyquote.com/quotes/malcolm_x_389773?src=t_respect,Malcolm X,https://www.brainyquote.com/authors/malcolm-x-quotes
I always respect a woman.,https://www.brainyquote.com/quotes/enrique_iglesias_288064?src=t_respect,Enrique Iglesias,https://www.brainyquote.com/authors/enrique-iglesias-quotes
"If we desire respect for the law, we must first make the law respectable.",https://www.brainyquote.com/quotes/louis_d_brandeis_106240?src=t_respect,Louis D. Brandeis,https://www.brainyquote.com/authors/louis-d-brandeis-quotes
