quote,quote_url,author,author_url
I would like to die on Mars. Just not on impact.,https://www.brainyquote.com/quotes/elon_musk_567227?src=t_space,Elon Musk,https://www.brainyquote.com/authors/elon-musk-quotes
"That's one small step for a man, one giant leap for mankind.",https://www.brainyquote.com/quotes/neil_armstrong_101137?src=t_space,Neil Armstrong,https://www.brainyquote.com/authors/neil-armstrong-quotes
The Universe is under no obligation to make sense to you.,https://www.brainyquote.com/quotes/neil_degrasse_tyson_800277?src=t_space,Neil deGrasse Tyson,https://www.brainyquote.com/authors/neil-degrasse-tyson-quotes
"The Earth is the cradle of humanity, but mankind cannot stay in the cradle forever.",https://www.brainyquote.com/quotes/konstantin_tsiolkovsky_183177?src=t_space,Konstantin Tsiolkovsky,https://www.brainyquote.com/authors/konstantin-tsiolkovsky-quotes
There are no passengers on spaceship earth. We are all crew.,https://www.brainyquote.com/quotes/marshall_mcluhan_100969?src=t_space,Marshall McLuhan,https://www.brainyquote.com/authors/marshall-mcluhan-quotes
The moon is a friend for the lonesome to talk to.,https://www.brainyquote.com/quotes/carl_sandburg_378082?src=t_space,Carl Sandburg,https://www.brainyquote.com/authors/carl-sandburg-quotes
Space is an inspirational concept that allows you to dream big.,https://www.brainyquote.com/quotes/peter_diamandis_488492?src=t_space,Peter Diamandis,https://www.brainyquote.com/authors/peter-diamandis-quotes
"The stars don't look bigger, but they do look brighter.",https://www.brainyquote.com/quotes/sally_ride_259203?src=t_space,Sally Ride,https://www.brainyquote.com/authors/sally-ride-quotes
Who are we? We find that we live on an insignificant planet of a humdrum star lost in a galaxy tucked away in some forgotten corner of a universe in which there are far more galaxies than people.,https://www.brainyquote.com/quotes/carl_sagan_122799?src=t_space,Carl Sagan,https://www.brainyquote.com/authors/carl-sagan-quotes
It takes a planet to explore the universe.,https://www.brainyquote.com/quotes/dylan_taylor_1195699?src=t_space,Dylan Taylor,https://www.brainyquote.com/authors/dylan-taylor-quotes
We are just an advanced breed of monkeys on a minor planet of a very average star. But we can understand the Universe. That makes us something very special.,https://www.brainyquote.com/quotes/stephen_hawking_122795?src=t_space,Stephen Hawking,https://www.brainyquote.com/authors/stephen-hawking-quotes
"If you are in a spaceship that is traveling at the speed of light, and you turn on the headlights, does anything happen?",https://www.brainyquote.com/quotes/steven_wright_161472?src=t_space,Steven Wright,https://www.brainyquote.com/authors/steven-wright-quotes
"Modern science says: 'The sun is the past, the earth is the present, the moon is the future.' From an incandescent mass we have originated, and into a frozen mass we shall turn. Merciless is the law of nature, and rapidly and irresistibly we are drawn to our doom.",https://www.brainyquote.com/quotes/nikola_tesla_596904?src=t_space,Nikola Tesla,https://www.brainyquote.com/authors/nikola-tesla-quotes
"Hey sky, take off your hat, I'm on my way!",https://www.brainyquote.com/quotes/valentina_tereshkova_734044?src=t_space,Valentina Tereshkova,https://www.brainyquote.com/authors/valentina-tereshkova-quotes
"When you look at the stars and the galaxy, you feel that you are not just from any particular piece of land, but from the solar system.",https://www.brainyquote.com/quotes/kalpana_chawla_182664?src=t_space,Kalpana Chawla,https://www.brainyquote.com/authors/kalpana-chawla-quotes
"If the Sun and Moon should ever doubt, they'd immediately go out.",https://www.brainyquote.com/quotes/william_blake_150119?src=t_space,William Blake,https://www.brainyquote.com/authors/william-blake-quotes
"I think the universe is pure geometry - basically, a beautiful shape twisting around and dancing over space-time.",https://www.brainyquote.com/quotes/antony_garrett_lisi_554520?src=t_space,Antony Garrett Lisi,https://www.brainyquote.com/authors/antony-garrett-lisi-quotes
"Whenever I gaze up at the moon, I feel like I'm on a time machine. I am back to that precious pinpoint of time, standing on the foreboding - yet beautiful - Sea of Tranquility. I could see our shining blue planet Earth poised in the darkness of space.",https://www.brainyquote.com/quotes/buzz_aldrin_679916?src=t_space,Buzz Aldrin,https://www.brainyquote.com/authors/buzz-aldrin-quotes
The eternal silence of these infinite spaces frightens me.,https://www.brainyquote.com/quotes/blaise_pascal_125541?src=t_space,Blaise Pascal,https://www.brainyquote.com/authors/blaise-pascal-quotes
"Space is big. You just won't believe how vastly, hugely, mind-bogglingly big it is. I mean, you may think it's a long way down the road to the drug store, but that's just peanuts to space.",https://www.brainyquote.com/quotes/douglas_adams_164151?src=t_space,Douglas Adams,https://www.brainyquote.com/authors/douglas-adams-quotes
"What can we gain by sailing to the moon if we are not able to cross the abyss that separates us from ourselves? This is the most important of all voyages of discovery, and without it, all the rest are not only useless, but disastrous.",https://www.brainyquote.com/quotes/thomas_merton_121047?src=t_space,Thomas Merton,https://www.brainyquote.com/authors/thomas-merton-quotes
You cannot look up at the night sky on the Planet Earth and not wonder what it's like to be up there amongst the stars. And I always look up at the moon and see it as the single most romantic place within the cosmos.,https://www.brainyquote.com/quotes/tom_hanks_466534?src=t_space,Tom Hanks,https://www.brainyquote.com/authors/tom-hanks-quotes
It's a very sobering feeling to be up in space and realize that one's safety factor was determined by the lowest bidder on a government contract.,https://www.brainyquote.com/quotes/alan_shepard_179873?src=t_space,Alan Shepard,https://www.brainyquote.com/authors/alan-shepard-quotes
"At night, when the sky is full of stars and the sea is still you get the wonderful sensation that you are floating in space.",https://www.brainyquote.com/quotes/natalie_wood_349233?src=t_space,Natalie Wood,https://www.brainyquote.com/authors/natalie-wood-quotes
What is the use of a house if you haven't got a tolerable planet to put it on?,https://www.brainyquote.com/quotes/henry_david_thoreau_107857?src=t_space,Henry David Thoreau,https://www.brainyquote.com/authors/henry-david-thoreau-quotes
I see nothing in space as promising as the view from a Ferris wheel.,https://www.brainyquote.com/quotes/e_b_white_101915?src=t_space,E. B. White,https://www.brainyquote.com/authors/e-b-white-quotes
Great industries are never made from single companies. There is room in space for a lot of winners.,https://www.brainyquote.com/quotes/jeff_bezos_769618?src=t_space,Jeff Bezos,https://www.brainyquote.com/authors/jeff-bezos-quotes
"I would rather be a superb meteor, every atom of me in magnificent glow, than a sleepy and permanent planet.",https://www.brainyquote.com/quotes/jack_london_102652?src=t_space,Jack London,https://www.brainyquote.com/authors/jack-london-quotes
"Sometimes I think we're alone in the universe, and sometimes I think we're not. In either case the idea is quite staggering.",https://www.brainyquote.com/quotes/arthur_c_clarke_140886?src=t_space,Arthur C. Clarke,https://www.brainyquote.com/authors/arthur-c-clarke-quotes
Space is to place as eternity is to time.,https://www.brainyquote.com/quotes/joseph_joubert_164186?src=t_space,Joseph Joubert,https://www.brainyquote.com/authors/joseph-joubert-quotes
"There is a fifth dimension, beyond that which is known to man. It is a dimension as vast as space and as timeless as infinity. It is the middle ground between light and shadow, between science and superstition.",https://www.brainyquote.com/quotes/rod_serling_102468?src=t_space,Rod Serling,https://www.brainyquote.com/authors/rod-serling-quotes
"Those are the same stars, and that is the same moon, that look down upon your brothers and sisters, and which they see as they look up to them, though they are ever so far away from us, and each other.",https://www.brainyquote.com/quotes/sojourner_truth_393494?src=t_space,Sojourner Truth,https://www.brainyquote.com/authors/sojourner-truth-quotes
"Oh, don't let's ask for the moon. We've already got the stars.",https://www.brainyquote.com/quotes/bette_davis_134006?src=t_space,Bette Davis,https://www.brainyquote.com/authors/bette-davis-quotes
America has tossed its cap over the wall of space.,https://www.brainyquote.com/quotes/john_f_kennedy_114947?src=t_space,John F. Kennedy,https://www.brainyquote.com/authors/john-f-kennedy-quotes
"The most important thing we can do is inspire young minds and to advance the kind of science, math and technology education that will help youngsters take us to the next phase of space travel.",https://www.brainyquote.com/quotes/john_glenn_402353?src=t_space,John Glenn,https://www.brainyquote.com/authors/john-glenn-quotes
We are not going to be able to operate our Spaceship Earth successfully nor for much longer unless we see it as a whole spaceship and our fate as common. It has to be everybody or nobody.,https://www.brainyquote.com/quotes/r_buckminster_fuller_153429?src=t_space,R. Buckminster Fuller,https://www.brainyquote.com/authors/r-buckminster-fuller-quotes
What we observe as material bodies and forces are nothing but shapes and variations in the structure of space.,https://www.brainyquote.com/quotes/erwin_schrodinger_304801?src=t_space,Erwin Schrodinger,https://www.brainyquote.com/authors/erwin-schrodinger-quotes
"If the Earth gets hit by an asteroid, it's game over. It's control-alt-delete for civilization.",https://www.brainyquote.com/quotes/bill_nye_541800?src=t_space,Bill Nye,https://www.brainyquote.com/authors/bill-nye-quotes
For the wise man looks into space and he knows there is no limited dimensions.,https://www.brainyquote.com/quotes/zhuangzi_134481?src=t_space,Zhuangzi,https://www.brainyquote.com/authors/zhuangzi-quotes
"We travel together, passengers on a little spaceship, dependent on its vulnerable reserves of air and soil, all committed, for our safety, to its security and peace. Preserved from annihilation only by the care, the work and the love we give our fragile craft.",https://www.brainyquote.com/quotes/adlai_stevenson_i_155713?src=t_space,Adlai Stevenson I,https://www.brainyquote.com/authors/adlai-stevenson-i-quotes
Planets move in ellipses with the Sun at one focus.,https://www.brainyquote.com/quotes/johannes_kepler_270665?src=t_space,Johannes Kepler,https://www.brainyquote.com/authors/johannes-kepler-quotes
"One in 200 stars has habitable Earth-like planets surrounding it - in the galaxy, half a billion stars have Earth-like planets going around them - that's huge, half a billion. So when we look at the night sky, it makes sense that someone is looking back at us.",https://www.brainyquote.com/quotes/michio_kaku_574540?src=t_space,Michio Kaku,https://www.brainyquote.com/authors/michio-kaku-quotes
"You never enjoy the world aright, till the sea itself floweth in your veins, till you are clothed with the heavens and crowned with the stars.",https://www.brainyquote.com/quotes/thomas_traherne_153853?src=t_space,Thomas Traherne,https://www.brainyquote.com/authors/thomas-traherne-quotes
The scientific theory I like best is that the rings of Saturn are composed entirely of lost airline luggage.,https://www.brainyquote.com/quotes/mark_russell_100093?src=t_space,Mark Russell,https://www.brainyquote.com/authors/mark-russell-quotes
Ye stars! which are the poetry of heaven!,https://www.brainyquote.com/quotes/lord_byron_380300?src=t_space,Lord Byron,https://www.brainyquote.com/authors/lord-byron-quotes
"The stars, that nature hung in heaven, and filled their lamps with everlasting oil, give due light to the misled and lonely traveller.",https://www.brainyquote.com/quotes/john_milton_394367?src=t_space,John Milton,https://www.brainyquote.com/authors/john-milton-quotes
I see Earth! It is so beautiful!,https://www.brainyquote.com/quotes/yuri_gagarin_183173?src=t_space,Yuri Gagarin,https://www.brainyquote.com/authors/yuri-gagarin-quotes
After one look at this planet any visitor from outer space would say 'I want to see the manager.',https://www.brainyquote.com/quotes/william_s_burroughs_386759?src=t_space,William S. Burroughs,https://www.brainyquote.com/authors/william-s-burroughs-quotes
The heart looks into space to be away from earth.,https://www.brainyquote.com/quotes/richard_jefferies_629177?src=t_space,Richard Jefferies,https://www.brainyquote.com/authors/richard-jefferies-quotes
"Houston, we've had a problem.",https://www.brainyquote.com/quotes/jim_lovell_202154?src=t_space,Jim Lovell,https://www.brainyquote.com/authors/jim-lovell-quotes
"When you launch in a rocket, you're not really flying that rocket. You're just sort of hanging on.",https://www.brainyquote.com/quotes/michael_p_anderson_249971?src=t_space,Michael P. Anderson,https://www.brainyquote.com/authors/michael-p-anderson-quotes
"According to String Theory, what appears to be empty space is actually a tumultuous ocean of strings vibrating at the precise frequencies that create the 4 dimensions you and I call height, width, depth and time.",https://www.brainyquote.com/quotes/roy_h_williams_357701?src=t_space,Roy H. Williams,https://www.brainyquote.com/authors/roy-h-williams-quotes
"Everything has a natural explanation. The moon is not a god, but a great rock, and the sun a hot rock.",https://www.brainyquote.com/quotes/anaxagoras_180732?src=t_space,Anaxagoras,https://www.brainyquote.com/authors/anaxagoras-quotes
"For NASA, space is still a high priority.",https://www.brainyquote.com/quotes/dan_quayle_100410?src=t_space,Dan Quayle,https://www.brainyquote.com/authors/dan-quayle-quotes
I think we are at the dawn of a new era in commercial space exploration.,https://www.brainyquote.com/quotes/elon_musk_567243?src=t_space,Elon Musk,https://www.brainyquote.com/authors/elon-musk-quotes
The dinosaurs became extinct because they didn't have a space program.,https://www.brainyquote.com/quotes/larry_niven_657451?src=t_space,Larry Niven,https://www.brainyquote.com/authors/larry-niven-quotes
"Do you realize that if you fall into a black hole, you will see the entire future of the Universe unfold in front of you in a matter of moments and you will emerge into another space-time created by the singularity of the black hole you just fell into?",https://www.brainyquote.com/quotes/neil_degrasse_tyson_531142?src=t_space,Neil deGrasse Tyson,https://www.brainyquote.com/authors/neil-degrasse-tyson-quotes
"Rocket science is tough, and rockets have a way of failing.",https://www.brainyquote.com/quotes/sally_ride_444233?src=t_space,Sally Ride,https://www.brainyquote.com/authors/sally-ride-quotes
"If you're going to go to the moon, you don't shoot the rocket right at the moon. You have to go at it obliquely.",https://www.brainyquote.com/quotes/drew_houston_659298?src=t_space,Drew Houston,https://www.brainyquote.com/authors/drew-houston-quotes
Space isn't remote at all. It's only an hour's drive away if your car could go straight upwards.,https://www.brainyquote.com/quotes/fred_hoyle_131119?src=t_space,Fred Hoyle,https://www.brainyquote.com/authors/fred-hoyle-quotes
