quote,quote_url,author,author_url
It takes courage to grow up and become who you really are.,https://www.brainyquote.com/quotes/e_e_cummings_161593?src=t_teen,e. e. cummings,https://www.brainyquote.com/authors/e-e-cummings-quotes
Youth comes but once in a lifetime.,https://www.brainyquote.com/quotes/henry_wadsworth_longfello_151369?src=t_teen,Henry Wadsworth Longfellow,https://www.brainyquote.com/authors/henry-wadsworth-longfello-quotes
Good habits formed at youth make all the difference.,https://www.brainyquote.com/quotes/aristotle_400385?src=t_teen,Aristotle,https://www.brainyquote.com/authors/aristotle-quotes
"We never really grow up, we only learn how to act in public.",https://www.brainyquote.com/quotes/bryan_white_170757?src=t_teen,Bryan White,https://www.brainyquote.com/authors/bryan-white-quotes
Keep true to the dreams of your youth.,https://www.brainyquote.com/quotes/friedrich_schiller_154938?src=t_teen,Friedrich Schiller,https://www.brainyquote.com/authors/friedrich-schiller-quotes
"Adolescence is a new birth, for the higher and more completely human traits are now born.",https://www.brainyquote.com/quotes/g_stanley_hall_381305?src=t_teen,G. Stanley Hall,https://www.brainyquote.com/authors/g-stanley-hall-quotes
Adolescence is just one big walking pimple.,https://www.brainyquote.com/quotes/carol_burnett_110994?src=t_teen,Carol Burnett,https://www.brainyquote.com/authors/carol-burnett-quotes
"When I was in college, I wanted to be involved in things that would change the world.",https://www.brainyquote.com/quotes/elon_musk_567259?src=t_teen,Elon Musk,https://www.brainyquote.com/authors/elon-musk-quotes
Teens think listening to music helps them concentrate. It doesn't. It relieves them of the boredom that concentration on homework induces.,https://www.brainyquote.com/quotes/marilyn_vos_savant_365258?src=t_teen,Marilyn vos Savant,https://www.brainyquote.com/authors/marilyn-vos-savant-quotes
"When I was growing up, my parents told me, 'Finish your dinner. People in China and India are starving.' I tell my daughters, 'Finish your homework. People in India and China are starving for your job.'",https://www.brainyquote.com/quotes/thomas_friedman_416676?src=t_teen,Thomas Friedman,https://www.brainyquote.com/authors/thomas-friedman-quotes
"Youth is not a time of life; it is a state of mind; it is not a matter of rosy cheeks, red lips and supple knees; it is a matter of the will, quality of the imagination, a vigor of the emotions; it is the freshness of the deep springs of life.",https://www.brainyquote.com/quotes/samuel_ullman_555363?src=t_teen,Samuel Ullman,https://www.brainyquote.com/authors/samuel-ullman-quotes
As a teenager I was so insecure. I was the type of guy that never fitted in because he never dared to choose. I was convinced I had absolutely no talent at all. For nothing. And that thought took away all my ambition too.,https://www.brainyquote.com/quotes/johnny_depp_169403?src=t_teen,Johnny Depp,https://www.brainyquote.com/authors/johnny-depp-quotes
Maturity is only a short break in adolescence.,https://www.brainyquote.com/quotes/jules_feiffer_102970?src=t_teen,Jules Feiffer,https://www.brainyquote.com/authors/jules-feiffer-quotes
"No matter how good you are, at some point your kids are gonna have to create their own independence and think that Mom and Dad aren't cool, just to establish themselves. That's what adolescence is about. They're gonna go through that no matter what.",https://www.brainyquote.com/quotes/eddie_vedder_481596?src=t_teen,Eddie Vedder,https://www.brainyquote.com/authors/eddie-vedder-quotes
This generation has given up on growth. They're just hoping for survival.,https://www.brainyquote.com/quotes/penelope_spheeris_367718?src=t_teen,Penelope Spheeris,https://www.brainyquote.com/authors/penelope-spheeris-quotes
The youth need to be enabled to become job generators from job seekers.,https://www.brainyquote.com/quotes/a_p_j_abdul_kalam_446332?src=t_teen,A. P. J. Abdul Kalam,https://www.brainyquote.com/authors/a-p-j-abdul-kalam-quotes
"Being a teen can be tough. Just try to surround yourself with really good friends that really have your back, and also be a really good friend to those who really care about you. If you're not sure about certain things, talk to your friends that you trust and your family.",https://www.brainyquote.com/quotes/victoria_justice_510946?src=t_teen,Victoria Justice,https://www.brainyquote.com/authors/victoria-justice-quotes
"To an adolescent, there is nothing in the world more embarrassing than a parent.",https://www.brainyquote.com/quotes/dave_barry_161267?src=t_teen,Dave Barry,https://www.brainyquote.com/authors/dave-barry-quotes
"Friendships in childhood are usually a matter of chance, whereas in adolescence they are most often a matter of choice.",https://www.brainyquote.com/quotes/david_elkind_400617?src=t_teen,David Elkind,https://www.brainyquote.com/authors/david-elkind-quotes
Being a teenager is an amazing time and a hard time. It's when you make your best friends - I have girls who will never leave my heart and I still talk to. You get the best and the worst as a teen. You have the best friendships and the worst heartbreaks.,https://www.brainyquote.com/quotes/sophia_bush_410469?src=t_teen,Sophia Bush,https://www.brainyquote.com/authors/sophia-bush-quotes
As a teenager you are at the last stage in your life when you will be happy to hear that the phone is for you.,https://www.brainyquote.com/quotes/fran_lebowitz_108062?src=t_teen,Fran Lebowitz,https://www.brainyquote.com/authors/fran-lebowitz-quotes
Telling a teenager the facts of life is like giving a fish a bath.,https://www.brainyquote.com/quotes/arnold_h_glasow_108071?src=t_teen,Arnold H. Glasow,https://www.brainyquote.com/authors/arnold-h-glasow-quotes
"So many people try to grow up too fast, and it's not fun! You should stay a kid as long as possible!",https://www.brainyquote.com/quotes/vanessa_hudgens_409651?src=t_teen,Vanessa Hudgens,https://www.brainyquote.com/authors/vanessa-hudgens-quotes
"Adolescents are not monsters. They are just people trying to learn how to make it among the adults in the world, who are probably not so sure themselves.",https://www.brainyquote.com/quotes/virginia_satir_403109?src=t_teen,Virginia Satir,https://www.brainyquote.com/authors/virginia-satir-quotes
You've got to grow up sometime.,https://www.brainyquote.com/quotes/winona_ryder_369015?src=t_teen,Winona Ryder,https://www.brainyquote.com/authors/winona-ryder-quotes
Adolescence is the conjugator of childhood and adulthood.,https://www.brainyquote.com/quotes/louise_j_kaplan_403933?src=t_teen,Louise J. Kaplan,https://www.brainyquote.com/authors/louise-j-kaplan-quotes
Adolescence isn't just about prom or wearing sparkly dresses.,https://www.brainyquote.com/quotes/jena_malone_224663?src=t_teen,Jena Malone,https://www.brainyquote.com/authors/jena-malone-quotes
All teenagers have this desire to somehow run away.,https://www.brainyquote.com/quotes/joan_chen_202940?src=t_teen,Joan Chen,https://www.brainyquote.com/authors/joan-chen-quotes
Adolescence is when girls experience social pressure to put aside their authentic selves and to display only a small portion of their gifts.,https://www.brainyquote.com/quotes/mary_pipher_393896?src=t_teen,Mary Pipher,https://www.brainyquote.com/authors/mary-pipher-quotes
"The area of teenage life is not necessarily rarefied; we've all gone through that period. It's not as rarefied as a western or a space adventure or a gangster film, but it has its own dynamic.",https://www.brainyquote.com/quotes/gus_van_sant_448872?src=t_teen,Gus Van Sant,https://www.brainyquote.com/authors/gus-van-sant-quotes
"Growing up, I've enjoyed hunting with my father.",https://www.brainyquote.com/quotes/dale_earnhardt_253581?src=t_teen,Dale Earnhardt,https://www.brainyquote.com/authors/dale-earnhardt-quotes
My teenage years were exactly what they were supposed to be. Everybody has their own path. It's laid out for you. It's just up to you to walk it.,https://www.brainyquote.com/quotes/justin_timberlake_328339?src=t_teen,Justin Timberlake,https://www.brainyquote.com/authors/justin-timberlake-quotes
Can you imagine young people nowadays making a study of trigonometry for the fun of it? Well I did.,https://www.brainyquote.com/quotes/clyde_tombaugh_264552?src=t_teen,Clyde Tombaugh,https://www.brainyquote.com/authors/clyde-tombaugh-quotes
"I'm a teenager, but I'm independent - I have my own apartment, I have my own life. And I think I have learned more than any of those teenagers have in school. I learned to be responsible, leaving my family and coming here alone.",https://www.brainyquote.com/quotes/adriana_lima_279852?src=t_teen,Adriana Lima,https://www.brainyquote.com/authors/adriana-lima-quotes
Time scoots along pretty fast when you grow up.,https://www.brainyquote.com/quotes/alan_ladd_318445?src=t_teen,Alan Ladd,https://www.brainyquote.com/authors/alan-ladd-quotes
"I have always had a sense that we are all pretty much alone in life, particularly in adolescence.",https://www.brainyquote.com/quotes/robert_cormier_219379?src=t_teen,Robert Cormier,https://www.brainyquote.com/authors/robert-cormier-quotes
"Nobody understands anyone 18, including those who are 18.",https://www.brainyquote.com/quotes/jim_bishop_110588?src=t_teen,Jim Bishop,https://www.brainyquote.com/authors/jim-bishop-quotes
"I spent the first fourteen years of my life convinced that my looks were hideous. Adolescence is painful for everyone, I know, but mine was plain weird.",https://www.brainyquote.com/quotes/uma_thurman_175067?src=t_teen,Uma Thurman,https://www.brainyquote.com/authors/uma-thurman-quotes
Teenagers today are more free to be themselves and to accept themselves.,https://www.brainyquote.com/quotes/john_knowles_191866?src=t_teen,John Knowles,https://www.brainyquote.com/authors/john-knowles-quotes
Time misspent in youth is sometimes all the freedom one ever has.,https://www.brainyquote.com/quotes/anita_brookner_149519?src=t_teen,Anita Brookner,https://www.brainyquote.com/authors/anita-brookner-quotes
"I was a quiet teenager, introverted, full of angst.",https://www.brainyquote.com/quotes/nigella_lawson_222708?src=t_teen,Nigella Lawson,https://www.brainyquote.com/authors/nigella-lawson-quotes
"If you just watch a teenager, you see a lot of uncertainty.",https://www.brainyquote.com/quotes/jamie_lee_curtis_360554?src=t_teen,Jamie Lee Curtis,https://www.brainyquote.com/authors/jamie-lee-curtis-quotes
"I think growing up is difficult and it's a process that I'm always interested in, with kids and adults, they are often on two different universes.",https://www.brainyquote.com/quotes/alice_hoffman_276214?src=t_teen,Alice Hoffman,https://www.brainyquote.com/authors/alice-hoffman-quotes
"At the age of 16 I was already dreaming of having a baby because I felt myself to be an adult, but my mum forbid it. Right now, I feel like a teenager and I want to have fun for one or two more years before starting a family.",https://www.brainyquote.com/quotes/milla_jovovich_173830?src=t_teen,Milla Jovovich,https://www.brainyquote.com/authors/milla-jovovich-quotes
"Trouble is, kids feel they have to shock their elders and each generation grows up into something harder to shock.",https://www.brainyquote.com/quotes/ben_lindsey_209694?src=t_teen,Ben Lindsey,https://www.brainyquote.com/authors/ben-lindsey-quotes
"I wanted to be with the kind of people I'd grown up with, but you can't go back to them and be one of them again, no matter how hard you try.",https://www.brainyquote.com/quotes/ethel_waters_314563?src=t_teen,Ethel Waters,https://www.brainyquote.com/authors/ethel-waters-quotes
Everybody is a teenage idol.,https://www.brainyquote.com/quotes/barry_gibb_199092?src=t_teen,Barry Gibb,https://www.brainyquote.com/authors/barry-gibb-quotes
We must tell girls their voices are important.,https://www.brainyquote.com/quotes/malala_yousafzai_662503?src=t_teen,Malala Yousafzai,https://www.brainyquote.com/authors/malala-yousafzai-quotes
Heredity is what sets the parents of a teenager wondering about each other.,https://www.brainyquote.com/quotes/laurence_j_peter_108064?src=t_teen,Laurence J. Peter,https://www.brainyquote.com/authors/laurence-j-peter-quotes
You have teenagers thinking they're going to make millions as NBA stars when that's not realistic for even 1 percent of them. Becoming a scientist or engineer is.,https://www.brainyquote.com/quotes/dean_kamen_176553?src=t_teen,Dean Kamen,https://www.brainyquote.com/authors/dean-kamen-quotes
"I think there's a time in your life where you don't feel like you fit in. I think everyone has that when you're a teenager, especially, and especially in the society we live in.",https://www.brainyquote.com/quotes/matthew_vaughn_248755?src=t_teen,Matthew Vaughn,https://www.brainyquote.com/authors/matthew-vaughn-quotes
I grew up in a house where nobody had to tell me to go to school every day and do my homework.,https://www.brainyquote.com/quotes/constance_baker_motley_352852?src=t_teen,Constance Baker Motley,https://www.brainyquote.com/authors/constance-baker-motley-quotes
We all have an interest in making sure teens grow up healthy and drug-free.,https://www.brainyquote.com/quotes/john_walters_208682?src=t_teen,John Walters,https://www.brainyquote.com/authors/john-walters-quotes
I got through my teen years by being a bit of a clown.,https://www.brainyquote.com/quotes/diane_cilento_349580?src=t_teen,Diane Cilento,https://www.brainyquote.com/authors/diane-cilento-quotes
"Your modern teenager is not about to listen to advice from an old person, defined as a person who remembers when there was no Velcro.",https://www.brainyquote.com/quotes/dave_barry_102386?src=t_teen,Dave Barry,https://www.brainyquote.com/authors/dave-barry-quotes
"To all those mothers and fathers who are struggling with teen-agers, I say, just be patient: even though it looks like you can't do anything right for a number of years, parents become popular again when kids reach 20.",https://www.brainyquote.com/quotes/marian_wright_edelman_463729?src=t_teen,Marian Wright Edelman,https://www.brainyquote.com/authors/marian-wright-edelman-quotes
"But when I was a teenager, the idea of spending the rest of my life in a factory was real depressing. So the idea that I could become a musician opened up some possibilities I didn't see otherwise.",https://www.brainyquote.com/quotes/wayne_kramer_282918?src=t_teen,Wayne Kramer,https://www.brainyquote.com/authors/wayne-kramer-quotes
The toddler must say no in order to find out who she is. The adolescent says no to assert who she is not.,https://www.brainyquote.com/quotes/louise_j_kaplan_403918?src=t_teen,Louise J. Kaplan,https://www.brainyquote.com/authors/louise-j-kaplan-quotes
"I mean, I'm pretty good in real life, but sometimes people seem surprised that I'm like a normal teenager and wear black nail polish and I'm just a little bit more edgy than the person I play on television.",https://www.brainyquote.com/quotes/brittany_snow_234495?src=t_teen,Brittany Snow,https://www.brainyquote.com/authors/brittany-snow-quotes
"Well, I could do it for a day, but I wouldn't want to be a teenager again. I really wouldn't.",https://www.brainyquote.com/quotes/jamie_lee_curtis_360564?src=t_teen,Jamie Lee Curtis,https://www.brainyquote.com/authors/jamie-lee-curtis-quotes
